137794,05576931,n,10,dislike experienced as an absence of friendliness,1502
137795,05577059,n,10,the feeling of being alienated from other people,1502
137796,05577212,n,10,a feeling of being disliked and alone,1502
137797,05577305,n,10,a feeling of intense dislike,1502
137798,05577411,n,10,a feeling of disliking something or what someone is doing,1502
137799,05577544,n,10,lack of respect accompanied by a feeling of intense dislike,1502
137800,05577676,n,10,strong feelings of dislike,1502
137801,05577810,n,10,hate coupled with disgust,1502
137802,05577970,n,10,intense aversion,1502
137803,05578076,n,10,disgust so strong it makes you feel sick,1502
137804,05578169,n,10,"a feeling of thankfulness and appreciation: ""he was overwhelmed with gratitude for their help""",1502
137805,05578355,n,10,warm friendly feelings of gratitude,1502
137806,05578483,n,10,a lack of gratitude,1502
137807,05578595,n,10,"a feeling of sympathy for someone or something: ""She felt strong concern for those less fortunate""",1502
137808,05578801,n,10,"a cause for feeling concern: ""his major care was the illness of his wife""",
137809,05578925,n,10,a feeling of excessive concern,1502
137810,05579029,n,10,a feeling of concern for the welfare of someone (especially someone defenseless),1502
137811,05579184,n,10,a feeling of lack of concern,1502
137812,05579322,n,10,unbiased impartial unconcern,1502
137813,05579445,n,10,"indifference by personal withdrawal: ""emotional distance""",1502
137814,05579569,n,10,avoiding emotional involvement,1502
137815,05579669,n,10,an absence of concern for the welfare of others,1502
137816,05579830,n,10,feelings of extreme heartlessness,1502
137817,05579963,n,10,a painful emotion resulting from an awareness of inadequacy or guilt,1502
137818,05580137,n,10,"a feeling of shame when you do something immoral: ""he has no conscience about his cruelty""",1502
137819,05580284,n,10,shame resulting from strong dislike of yourself or your actions,1502
137820,05580420,n,10,the shame you feel when your inadequacy or guilt is made public,1502
137821,05580651,n,10,embarrassment deriving from the feeling that others are critically aware of you,1502
137822,05580828,n,10,feeling embarrassed about yourself,1502
137823,05580938,n,10,strong feelings of embarrassment,1502
137824,05581054,n,10,a feeling of embarrassment that leaves you confused,1502
137825,05581180,n,10,feeling embarrassed due to modesty,1502
137826,05581284,n,10,anxious embarrassment,1502
137827,05581430,n,10,a feeling of self-respect and personal worth,1502
137828,05581613,n,10,a feeling of pride in yourself,1502
137829,05581714,n,10,an inflated feeling of pride in your superiority to others,1502
137830,05581850,n,10,feelings of excessive pride,1502
137831,05581967,n,10,"a humble feeling: ""he was filled with humility at the sight of the Pope""",1502
137832,05582161,n,10,the feeling of patient submissive humbleness,1502
137833,05582260,n,10,a feeling of being of little worth,1502
137834,05582358,n,10,"the feeling that accompanies something extremely surprising: ""he looked at me in astonishment""",1502
137835,05582577,n,10,the feeling aroused by something strange and surprising,1502
137836,05582729,n,10,"an overwhelming feeling of wonder or admiration: ""he stared over the edge with a feeling of awe""",1502
137837,05582875,n,10,the astonishment you feel when something totally unexpected happens to you,1502
137838,05583004,n,10,a feeling of stupefied astonishment,1502
137839,05583116,n,10,"a sudden state of violent emotional disturbance: ""the shock of his mother's death""",1502
137840,05583266,n,10,the feeling that something is about to happen,1502
137841,05583387,n,10,pleasurable expectation,1502
137842,05583536,n,10,"excited anticipation of an approaching climax: ""the play kept the audience in suspense""",1502
137843,05583678,n,10,"intense nervous anticipation: ""in a fever of resentment""",1502
137844,05583804,n,10,nervous excitement of an inexperienced hunter,1502
137845,05583906,n,10,"a specific instance of feeling hopeful: ""it revived their hope of winning the pennant""",1502
137846,05584043,n,10,feeling an inappropriate lack of seriousness,1502
137847,05584176,n,10,a festive merry feeling,1502
137848,05584266,n,10,a solemn and dignified feeling,1502
137849,05584398,n,10,an earnest and sincere feeling,1502
137850,05584512,n,10,sensitivity to emotional feelings (of self and others),1502
137851,05584730,n,10,sensitivity leading to easy irritation or upset,1502
137852,05584841,n,10,"refined sensitivity to pleasurable or painful impressions: ""cruelty offended his sensibility""",1502
137853,05585046,n,10,"emotional or moral sensitivity (especially in relation to personal principles or dignity); ""the remark hurt his feelings""",1502
137854,05585222,n,10,a feeling of understanding,1502
137855,05585334,n,10,a sensuous feeling,1502
137856,05585411,n,10,"sensibility to trouble (as in the phrase ""wring one's withers""); ""the lawsuit was wringing his withers""; ""our withers are unwrung""-Shakespeare",1502
137857,05585608,n,10,the feeling of being agitated; not calm,1502
137858,05585811,n,10,a feeling of restless agitation,1502
137859,05585895,n,10,"a feeling of agitation expressed in continual motion: ""he's got the fidgets""; ""waiting gave him a feeling of restlessness""",1502
137860,05586117,n,10,a restless desire for change and excitement,1502
137861,05586217,n,10,"an extreme state of worry and agitation: ""his stewing over the fight kept him awake most of the night""",1502
137862,05586373,n,10,emotional agitation and excitement,1502
137863,05586494,n,10,violent agitation,1502
137864,05586574,n,10,"keen and shared excitement: ""the stage crackled with electricity whenever she was on it""",1502
137865,05586720,n,10,"a general feeling of excitement: ""the announcement caused a sensation""",1502
137866,05586846,n,10,a feeling of calm; an absence of agitation or excitement,1502
137867,05587029,n,10,a feeling of calmness; a quiet and undisturbed feeling,1502
137868,05587152,n,10,"calm and unruffled self-assurance; ""he performed with all the coolness of a veteran""",1502
137869,05587339,n,10,a state of peace and quiet,1502
137870,05587497,n,10,the absence of mental stress or anxiety,1502
137871,05587663,n,10,a state of refreshing tranquility,1502
137872,05587782,n,10,a relaxed comfortable feeling,1502
137873,05587878,n,10,a strong emotion; a feeling that is oriented toward some real or supposed grievance,1502
137874,05588172,n,10,"a feeling of intense indignation (now used only in the phrase ""in high dudgeon"")",1502
137875,05588321,n,10,intense anger (usually on an epic scale),1502
137876,05588413,n,10,"a feeling of intense anger: ""hell hath no fury like a woman scorned""; ""his face turned red with rage""",1502
137877,05588618,n,10,a state of fury so great the face becomes discolored,1502
137878,05588725,n,10,a feeling of intense anger,1502
137879,05588822,n,10,"a feeling of anger caused by an offence: ""give or take umbrage or offense""",1502
137880,05588960,n,10,a feeling of righteous anger,1502
137881,05589074,n,10,a passing state of anger and resentment,1502
137882,05589169,n,10,"a feeling of anger and animosity: ""having one's hackles or dander up""",1502
137883,05589301,n,10,a persisting angry mood,1502
137884,05589430,n,10,anger produced by some annoying irritation,1502
137885,05589637,n,10,"a sudden outburst of anger: ""his temper sparked like damp firewood""",1502
137886,05589778,n,10,"a feeling of annoyance at being hindered or criticized: ""her constant complaints were the main source of his frustration""",1502
137887,05589957,n,10,an exasperated feeling of annoyance,1502
137888,05590065,n,10,"a feeling of intense annoyance caused by being tormented: ""so great was his harassment that he wanted to destroy his tormentors""",1502
137889,05590260,n,10,an emotion experienced in anticipation of some specific pain or danger (usually accompanied by a desire to flee or fight),1502
137890,05590744,n,10,fear resulting from the awareness of danger,1502
137891,05590900,n,10,"(informal) a feeling of fear and revulsion; ""he gives me the creeps""",1502
137892,05591021,n,10,"an almost pleasurable sensation of fright: ""a frisson of surprise shot through him""",1502
137893,05591212,n,10,intense and profound fear,1502
137894,05591290,n,10,excessive or uncontrollable fear,1502
137895,05591377,n,10,an overwhelming feeling of fear and anxiety,1502
137896,05591481,n,10,a profound fear inspired by a deity,1502
137897,05591591,n,10,a sudden attack of fear,1502
137898,05591681,n,10,fear that affects a person about to face an audience,1502
137899,05591792,n,10,"fearful expectation or anticipation: ""the student looked around the examination room with apprehension""",1502
137900,05592071,n,10,a feeling of alarm or dread,1502
137901,05592156,n,10,"a feeling of evil to come: ""a steadily escalating sense of foreboding""; ""the lawyer had a presentiment that the judge would dismiss the case""",1502
137902,05592428,n,10,"a premonition of something adverse: ""a shadow over his happiness""",1502
137903,05592546,n,10,a foreboding about what is about to happen,1502
137904,05592642,n,10,apprehension about what is going to happen,1502
137905,05592739,n,10,fear of the unknown or unfamiliar and of making decisions,1502
137906,05592914,n,10,a feeling of fear of embarrassment,1502
137907,05593002,n,10,lack of self-confidence,1502
137908,05593183,n,10,a feeling of diffidence about doing something,1502
137909,05593296,n,10,diffidence about self promotion,1502
137910,05593389,n,10,the feeling of being intimidated,1502
137971,05602526,n,10,a feeling of deep regret (usually for some misdeed),1502
137911,05593480,n,10,a vague unpleasant emotion that is experienced in anticipation of some (usually ill-defined) misfortune,1502
137912,05593817,n,10,"a strong feeling of anxiety: ""his distress as the prospect of being fired""; ""it is not work but worry that kills""; ""he wanted to die and end his troubles""",1502
137913,05594044,n,10,"an anxious feeling: ""care had aged him""; ""they hushed it up out of fear of public reaction""",1502
137914,05594203,n,10,a feeling of mild anxiety about possible developments,1502
137915,05594325,n,10,the anxiety you experience when you feel vulnerable and insecure,1502
137916,05594446,n,10,feelings of anxiety that make you tense and irritable,1502
137917,05594594,n,10,"a feeling caused by uneasiness or apprehension: ""with a sinking heart""; ""a sinking feeling in the pit of my stomach""",1502
137918,05594782,n,10,uneasiness about the fitness of an action,1502
137919,05594897,n,10,the anxious feeling you have when you have the jitters,1502
137920,05595049,n,10,an acute but unspecific feeling of anxiety; usually reserved for philosophical anxiety about the world or about personal freedom,1502
137921,05595229,n,10,feeling no fear,1502
137922,05595349,n,10,"freedom from anxiety or fear: ""the watch dog gave her a feeling of security""",1502
137923,05595498,n,10,"a feeling of trust (in someone or something); ""I have confidence in our team""; ""confidence is always borrowed, never owned""",1502
137924,05595732,n,10,emotions experienced when in a state of well-being,1502
137925,05596018,n,10,(French) happiness and good humor,1502
137926,05596105,n,10,experiencing joy and pleasure,1502
137927,05596218,n,10,the emotion of great happiness,1502
137928,05596414,n,10,a feeling of joy and pride,1502
137929,05596527,n,10,a feeling of extreme joy,1502
137930,05596663,n,10,the exultation of victory,1502
137931,05596742,n,10,"the feeling of lively and cheerful joy: ""he could hardly conceal his excitement when she agreed""",1502
137932,05596946,n,10,"the release of a store of affective force: ""they got a great bang out of it""; ""what a rush!""; ""he does it for kicks""",1502
137933,05597153,n,10,an aroused excitement (as from teasing),1502
137934,05597250,n,10,a feeling of great (usually exaggerated) elation,1502
137935,05597371,n,10,a gay feeling,1502
137936,05597503,n,10,great merriment,1502
137937,05597617,n,10,a feeling of great happiness,1502
137938,05597701,n,10,a feeling facetious merriment,1502
137939,05597799,n,10,"happiness felt in a secure relationship: ""with his classmates he felt a sense of belonging""",1502
137940,05597982,n,10,a feeling of being at ease in a relationship,1502
137941,05598089,n,10,"a feeling of being intimate and belonging together: ""their closeness grew as the night wore on""",1502
137942,05598269,n,10,affectionate closeness,1502
137943,05598350,n,10,"a feeling of spontaneous good spirits: ""his cheerfulness made everyone feel better""",1502
137944,05598559,n,10,cheerfulness that bubbles to the surface,1502
137945,05598666,n,10,the cheerful feeling you have when nothing is troubling you,1502
137946,05598833,n,10,happiness with one's situation in life,1502
137947,05598965,n,10,"the contentment you feel when you have done something right: ""the chef tasted the sauce with great satisfaction""",1502
137948,05599226,n,10,"satisfaction with your (or another's) achievements; ""he takes pride in his son's success""",1502
137949,05599367,n,10,"the feeling you have when you are satisfied with yourself: ""his complacency was absolutely disgusting""",1502
137950,05599598,n,10,an excessive feeling of self-satisfaction,1502
137951,05599694,n,10,a feeling of satisfaction at having achieved your desires,1502
137952,05599822,n,10,malicious satisfaction,1502
137953,05599930,n,10,emotions experienced when not in a state of well-being,1502
137954,05600250,n,10,sadness caused by grief or affliction,1502
137955,05600345,n,10,a feeling of thoughtful sadness,1502
137956,05600505,n,10,a feeling of melancholy apprehension,1502
137957,05600637,n,10,a feeling of dispirited melancholy,1502
137958,05600734,n,10,persistent morbid meditation on a problem,1502
137959,05600844,n,10,sadness on thinking about the evils of the world,1502
137960,05600968,n,10,intense mournfulness,1502
137961,05601051,n,10,"a feeling of intense unhappiness: ""she was exhausted by her misery and grief""",1502
137962,05601181,n,10,sadness resulting from being forsaken or abandoned,1502
137963,05601315,n,10,sadness expressed by weeping,1502
137964,05601413,n,10,"an emotion of great sadness associated with loss or bereavement: ""he tried to express his sorrow at her loss""",1502
137965,05601647,n,10,sorrow for sin arising from fear of damnation,1502
137966,05601776,n,10,intense sorrow caused by loss of a loved one (especially by death),1502
137967,05601957,n,10,a state of gloomy sorrow,1502
137968,05602106,n,10,expressing sorrowfulness,1502
137969,05602190,n,10,painful grief; a poetic term,1502
137970,05602279,n,10,"sadness associated with some wrong done or some disappointment: ""he drank to drown his sorrows""; ""he wrote a note expressing his regret""",1502
137972,05602697,n,10,remorse cause by feeling responsible for some offence,1502
137973,05602852,n,10,remorse for your past conduct,1502
137974,05602960,n,10,a feeling of dreary or pessimistic sadness,1502
137975,05603115,n,10,a sudden numbing dread,1502
137976,05603196,n,10,a feeling of dismal cheerlessness,1502
137977,05603287,n,10,sad feelings of gloom and inadequacy,"1502,2232"
137978,05603470,n,10,a feeling of lowness of spirits,1502
137979,05603599,n,10,depression resulting from an undermining of your morale,"1502,2232"
137980,05603715,n,10,a feeling of being unable to manage,"1502,2232"
137981,05603809,n,10,a feeling of sorrow (often self-indulgent) over your own sufferings,1502
137982,05603932,n,10,feeling downcast and disheartened and hopeless,"1502,2232"
137983,05604103,n,10,a fit of despondency,"1502,2232"
137984,05604181,n,10,a feeling of being oppressed,"1502,2232"
137985,05604301,n,10,"an oppressive feeling of heavy force: ""bowed down by the weight of responsibility""",1502
137986,05604436,n,10,a longing for something better than the present situation,1502
137987,05604658,n,10,a feeling of sulky discontent,1502
137988,05604748,n,10,abnormal depression and discontent,"1502,2232"
137989,05604874,n,10,"the feeling of being displeased and discontent: ""he was never slow to express his dissatistfaction with the service he received""",1502
137990,05605136,n,10,the feeling of being bored by something tedious,1502
137991,05605272,n,10,(informal usage) a general feeling of boredom and dissatisfaction,1502
137992,05605389,n,10,the feeling of being displeased or annoyed or dissatisfied with someone or something,1502
137993,05605549,n,10,"a feeling of dissatisfaction that results when your expectations are not realized: ""his hopes were so high he was doomed to disappointment""",1502
137994,05605777,n,10,the feeling that accompanies an experience of being thwarted in attaining your goals,1502
137995,05605928,n,10,"the general feeling that some desire will be fulfilled: ""in spite of his troubles he never gave up hope""",1502
137996,05606155,n,10,the feeling you have when you have hope,1502
137997,05606270,n,10,the feeling of being encouraged,1502
137998,05606361,n,10,the optimistic feeling that all is going to turn out well,1502
137999,05606509,n,10,feeling sanguine; optimistically cheerful and confident,1502
138000,05606636,n,10,the feeling that everything is wrong and nothing will turn out well,1502
138001,05606847,n,10,the despair you feel when you have abandoned hope of comfort or success,1502
138002,05606995,n,10,acceptance of despair,1502
138003,05607104,n,10,acceptance of the inevitability of defeat,1502
138004,05607201,n,10,the feeling of despair in the face of obstacles,1502
138005,05607353,n,10,the feeling of discouragement in the face of someone's superior fame or wealth or status etc.,1502
138006,05607505,n,10,the feeling that things will turn out badly,1502
138007,05607640,n,10,a cynical feeling of distrust,1502
138008,05607724,n,10,"a strong positive emotion of regard and affection: ""his love for his work""; ""children need a lot of love""",1502
138009,05608042,n,10,intense feeling of love,1502
138010,05608126,n,10,a feeling of sexual love,1502
138011,05608223,n,10,temporary love of an adolescent,1502
138012,05608345,n,10,"feelings of ardent love: ""their devotion to each other was beautiful""",1502
138013,05608483,n,10,"a positive feeling of liking: ""he had trouble expressing the affection he felt""; ""the child won everyone's heart""",1502
138014,05608793,n,10,a feeling of affection for a person or an institution,1502
138015,05608917,n,10,a feeling of protective affection,1502
138016,05609011,n,10,"a feeling of friendship and esteem: ""she mistook his manly regard for love""; ""he inspires respect""",1502
138017,05609172,n,10,"a sentimental affection: ""she had a soft spot for her youngest son""",1502
138018,05609295,n,10,disposition to do good,1502
138019,05609411,n,10,doing good; feeling beneficent,1502
138020,05609517,n,10,a loving feeling,1502
138021,05609617,n,10,a warmhearted feeling,1502
138022,05609709,n,10,feelings of allegiance,1502
138023,05609785,n,10,the emotion of hate; a feeling of dislike so strong that it demands action,1502
138024,05610135,n,10,hatred of mankind,1502
138025,05610210,n,10,hatred of marriage,1502
138026,05610283,n,10,hatred of women,1502
138027,05610366,n,10,hatred of reasoning,1502
138028,05610440,n,10,hatred of change or innovation,1502
138029,05610544,n,10,hatred of new ideas,1502
138030,05610620,n,10,hatred of children,1502
138031,05610694,n,10,a bloodthirsty hatred arousing murderous impulses,1502
138032,05610803,n,10,a feeling of scornful hatred,1502
138033,05610898,n,10,"the feeling of a hostile person: ""he could no longer contain his hostility""",1502
138034,05611157,n,10,a feeling of ill will arousing active hostility,1502
138035,05611281,n,10,feelings of envy and resentment of one social or economic class for toward another,1502
138036,05611423,n,10,an actively expressed feeling of dislike and hostility,1502
138037,05611552,n,10,a feeling of hostility that arouses thoughts of attack,1502
138038,05611680,n,10,hostile or warlike attitude or nature,1502
138039,05611809,n,10,"hostile or belligerent mood: ""the chief is on the warpath today""",1502
138040,05611927,n,10,a feeling of deep and bitter anger and ill-will,1502
138041,05612142,n,10,"intense resentment: ""his promotion caused much heartburning among his rivals""",1502
138042,05612278,n,10,a feeling of sulky resentment,1502
138043,05612377,n,10,"a resentment strong enough to justify retaliation: ""holding a grudge""; ""settling a score""",1502
138044,05612539,n,10,a feeling of grudging admiration and desire to have something possessed by another,1502
138045,05612765,n,10,an envious eagerness to possess something,1502
138046,05612865,n,10,a feeling of jealous envy (especially of a rival),1502
138047,05612990,n,10,(psychoanalysis) a female's envy of the male's penis; said to explain femininity,"1502,1874"
138048,05613127,n,10,wishing evil to others,1502
138049,05613291,n,10,doing or causing evil,1502
138050,05613388,n,10,feeling a need to see other suffer,1502
138051,05613522,n,10,a malevolent desire for revenge,1502
138052,05613629,n,10,"a characteristic (habitual or relatively temporary) state of feeling; ""whether he praised or cursed me depended on his temper at the time""; ""he was in a bad humor""",1502
138053,05613923,n,10,"a mood or display of sullen aloofness or withdrawal: ""stayed home in a sulk""",1502
138054,05614062,n,10,a cheerful and agreeable mood,1502
138055,05614225,n,10,feeling jolly and jovial and full of good humor,1502
138056,05614356,n,10,an angry and disagreeable mood,1502
138057,05614509,n,10,a sullen gloomy feeling,1502
138058,05614606,n,10,a gloomy ill-tempered feeling,1502
138059,05614716,n,10,a feeling of resentful anger,1502
138060,05614842,n,10,an irritable petulant feeling,1502
138061,05615021,n,10,feeling easily irritated,1502
138062,05615127,n,10,sharing the feelings of others (especially feelings of sorrow or anguish),1502
138063,05615380,n,10,sympathy arising from a kind heart,1502
138064,05615476,n,10,a deep awareness of and sympathy for another's suffering,1502
138065,05615645,n,10,"a feeling of sympathy and sorrow for the misfortunes of others: ""the blind are too often objects of pity""",1502
138066,05615833,n,10,warm compassionate feelings,1502
138067,05615937,n,10,the feeling that motivates compassion,1502
138068,05616059,n,10,compassionate feelings that support a willingness to forgive,1502
138069,05616177,n,10,a feeling of sympathetic understanding,1502
138070,05616285,n,10,understanding and entering into another's feelings,1502
138071,05616407,n,10,"the attribution to yourself of the characteristics of others: ""his identification with his father shaped his entire life""",1502
138072,05616611,n,10,a feeling of excitement,1502
138073,05616745,n,10,a positive feeling of wanting to push ahead with something,1502
138074,05616909,n,10,"a feeling of strong eagerness (usually in favor of a person or cause); ""they were imbued with a revolutionary ardor""; ""he felt a kind of religious zeal""",1502
138075,05617136,n,10,joyful enthusiasm,1502
138076,05617228,n,10,the art or science of food,2354
138077,05617311,n,10,any substance that can be used as food,2354
138078,05617456,n,10,food to be eaten with the fingers,1957
138079,05617547,n,10,a heavy filling and often starchy food,1957
138080,05617638,n,10,food that fulfills the requirements of Jewish dietary law,1957
138081,05617748,n,10,the food and drink that are regularly consumed,2354
138082,05617971,n,10,the usual food and drink consumed by an organism (person or animal),2354
138083,05618089,n,10,a prescribed selection of foods,2354
138084,05618405,n,10,a regulated daily food allowance,2354
138085,05618491,n,10,a diet designed to avoid the foods that you are allergic to,2354
138086,05618609,n,10,a diet that contains adequate amounts of all the necessary nutrients required for healthy growth and activity,2354
138087,05618778,n,10,"a diet of foods that are not irritating: ""he ate a bland diet because of his colitis""",2354
138088,05618933,n,10,a diet of fluids with minimal residues (fat-free broth or strained fruit juices or gelatin); cannot be used for more than one day postoperative,2354
138089,05619140,n,10,a diet designed to help control the symptoms of diabetes,2354
138090,05619256,n,10,"a diet of foods high in starch that increases carbohydrate reserves in muscles: ""carbo loading is used by endurance athletes just before competing""",2354
138091,05619486,n,10,a reducing diet that enjoys temporary popularity,2354
138092,05619589,n,10,a diet high in plant and animal proteins; used to treat malnutrition or to increase muscle mass,2354
138093,05619748,n,10,a diet designed to patients with vitamin deficiencies,2354
138094,05619891,n,10,a diet of foods that can be served in liquid or strained form (plus custards or puddings); prescribed after certain kinds of surgery,2354
138095,05620099,n,10,a diet that is low on calories,2354
138096,05620192,n,10,a diet containing limited amounts of fat and stressing high-carbohydrate foods; used in treatment of some gallbladder conditions,2354
138097,05620379,n,10,a diet that limits the intake of salt (sodium chloride); often used in treating hypertension or edema or certain other disorders,2354
138098,05620602,n,10,a diet consisting chiefly of beans and whole grains,2354
138099,05620716,n,10,a diet designed to help you lose weight (especially fat),2354
138100,05620883,n,10,a diet that does not require chewing; advised for those with intestinal disorders,2354
138101,05621048,n,10,a diet excluding all meat and fish,2354
138102,05621160,n,10,the dishes making up a meal,2354
