136961,05453699,n,10,a serious collision (especially of motor vehicles),1946
136962,05453812,n,10,"an accidental misstep threatening (or causing) a fall; ""he blamed his slip on the ice""; ""the jolt caused many slips and a few spills""",
136963,05454021,n,10,an event that does not accomplish its intended purpose,
136964,05454273,n,10,failure that results in a loss of position or reputation,
136965,05454384,n,10,a failure to function normally,
136966,05454490,n,10,"a malfunction in the flight of an aircraft in which there is a sudden loss of lift that results in a downward plunge: ""the plane went into a stall and I couldn't control it""",1942
136967,05454715,n,10,"an event that accomplishes its intended purpose: ""let's call heads a success and tails a failure""; ""the election was a remarkable success for Republicans""",
136968,05454977,n,10,"(informal) a impressively successful event; ""the rock concert was a real barnburner""",
136969,05455118,n,10,"a successful journey: ""they wished him Godspeed""",2772
136970,05455221,n,10,any weakening or degeneration (especially through lack of use),
136971,05455349,n,10,becoming weaker,
136972,05455528,n,10,"weakening in force or intensity: ""attenuation in the volume of the sound""",
136973,05455668,n,10,becoming stronger,
136974,05455763,n,10,"a sudden decline in strength or number or importance: ""the fall of the House of Hapsburg""",
136975,05455950,n,10,"a disappointing decline after ad previous rise: ""the anticlimax of a brilliant career""",
136976,05456093,n,10,failure of a plan,
136977,05456179,n,10,a failure to hit (or meet or find etc),
136978,05456279,n,10,"the becoming visible: ""not a day's difference between the emergence of the andrenas and the opening of the willow catkins""",
136979,05456510,n,10,the emergence of a tooth as it breaks through the gum,
136980,05456618,n,10,"the event of being born: ""they celebrated the birth of their first child""",
136981,05456848,n,10,"the event of giving birth: ""she had a difficult delivery""",
136982,05456978,n,10,the birth of a living fetus,
136983,05457098,n,10,(informal) the live birth of a child,
136984,05457208,n,10,delivery of an infant whose feet appear first,
136985,05457330,n,10,a second or new birth,
136986,05457439,n,10,the passing of a soul into another body after death,
136987,05457551,n,10,the event of coming into sight,
136988,05457728,n,10,appearing again,
136989,05457802,n,10,(Christian theology) the reappearance of Jesus as judge for the Last Judgment,1608
136990,05457964,n,10,an appearance in bodily form (as of a ghost),
136991,05458088,n,10,"a clear appearance: ""a manifestation of great emotion""",
136992,05458256,n,10,"an unexpected appearance or becoming visible: ""I was recalled to the present by the apparition of two cowboys riding toward me""",
136993,05458440,n,10,a divine manifestation,
136994,05458517,n,10,a manifestation of the mind and will of God,
136995,05458618,n,10,an event that is a beginning; a first part or stage of subsequent events,
136996,05458815,n,10,"the gradual beginning or coming forth: ""figurines presage the emergence of sculpture in Greece""",
136997,05459005,n,10,a growth in strength or number or importance,
136998,05459154,n,10,a sudden rise in the crime rate,
136999,05459242,n,10,"the beginning of anything: ""it was off to a good start""",
137000,05459493,n,10,the increase in activity of the adrenal glands just before puberty,
137001,05459616,n,10,the first occurrence of menstruation in a woman,
137002,05459718,n,10,"the beginning or early stages: ""the onset of pneumonia""",
137003,05459836,n,10,"the earliest period: ""the dawn of civilization""; ""the morning of the world""",
137004,05459972,n,10,"the first event in a series: ""she played Chopin for her opener""; ""the season's opener was a game agains the Yankees""",
137005,05460141,n,10,"events that provide the generative force that is the origin of something: ""they are trying to determine the cause of the crash""",
137006,05460392,n,10,a preceding occurrence or cause or event,1451
137007,05460489,n,10,"something that serves as a preceding event or introduces what follows: ""training is a necessary preliminary to employment""; ""drinks were the overture to dinner""",
137008,05460728,n,10,the cause of a disease,
137009,05460817,n,10,"anything that contributes causally to a result: ""a number of factors determined the outcome""",
137010,05461016,n,10,any factor that defines a system and determines (or limits) its performance,
137011,05461147,n,10,"a factor in a given situation whose bearing and importance is not apparent: ""I don't know what the new man will do; he's still an unknown quantity""",
137012,05461357,n,10,"something that produces: ""Maine is a leading producer of potatoes"" or ""this microorganism is a producer of disease""",
137013,05461527,n,10,"the event that occured at the beginning of something: ""from its creation the plan was doomed to failure""",2158
137014,05461717,n,10,"the beginning of a series or sequence: ""the Alpha and Omega, the first and the last, the beginning and the end""-Revelations",
137015,05461893,n,10,"the first performance (as of a theatrical production); ""the opening received good critical reviews""",
137016,05462080,n,10,"a start given to contestants: ""I was there with my parents at the kickoff""",
137017,05462231,n,10,an event (or course of events) that will inevitably happen in the future,
137018,05462436,n,10,"an unavoidable event: ""don't argue with the inevitable""",
137019,05462548,n,10,(Hinduism and Buddhism) the effects of a person's actions that determine his destiny in his next incarnation,1565
137020,05462708,n,10,(Islamic) the will of Allah,1565
137021,05462797,n,10,"total destruction: ""bomb tests resulted in the annihilation of the atoll""",
137022,05462964,n,10,the complete destruction of every trace of something,
137023,05463089,n,10,serious weakening and loss of energy,
137024,05463225,n,10,coming apart,
137025,05463353,n,10,process or result of distributing or extending over a wide expanse of space,
137026,05463529,n,10,the spread of social institutions (and myths and skills) from one society to another,
137027,05463669,n,10,driving off or spreading widely,
137028,05463806,n,10,the dispersion of the Jews from Palestine after the Babylonian exile (358 BC),
137029,05463938,n,10,"breaking up and scattering by dispersion: ""the dissipation of the mist""",
137030,05464067,n,10,"complete annihilation: ""they think a meteor cause the extinction of the dinosaurs""",
137031,05464222,n,10,the death of Jesus on the cross after he was condemned by the Jews as a false Messiah,1565
137032,05464365,n,10,"a death resulting from an accident or a disaster: ""a decrease in the number of automobile fatalities""",
137033,05464571,n,10,"the absolute defeat and death of persons on one side of a conflict: ""it was a fight to the finish""; ""he will be the finish of me""",
137034,05464753,n,10,death that is imposed because of the person's adherence of a religious faith or cause,1565
137035,05464894,n,10,"the death of a million people: ""they calibrate the effects of atom bombs in megadeaths""",
137036,05465037,n,10,"euphemistic expressions for death: ""thousands mourned his passing""",
137037,05465214,n,10,"an unpleasant or disastrous destiny: ""everyone was aware of the approaching doom but was helpless to avoid it""",
137038,05465405,n,10,an event that destroys something,
137039,05465616,n,10,"(usually plural) a destructive action; ""the ravages of time""",
137040,05465729,n,10,the event of a structure being completely demolished and leveled,1707
137041,05465857,n,10,an event that results in destruction,
137042,05465992,n,10,an event that results in total destruction,
137043,05466105,n,10,"the destruction or collapse of something: ""wrack and ruin""",
137044,05466222,n,10,the event of passing out of sight,
137045,05466369,n,10,a sudden or mysterious disappearance,
137046,05466461,n,10,a slow or gradual disappearance,
137047,05466557,n,10,"a stroke of ill fortune; a calamitous event: ""a period marked by adversities""",
137048,05466690,n,10,"something that causes or entails suffering: ""I cannot thinking it a hardship that more more indulgence is allowed to men than to women""-James Boswell; ""the many hardships of frontier life""",
137049,05466934,n,10,"a bad experience: ""the school of hard knocks""",
137050,05467031,n,10,an instance of change; the rate or magnitude of change,
137051,05467299,n,10,"a variation in circumstances or fortune at different times in your life or in the development of something: ""the project was subject to the usual vicissitudes of exploratory research""",
137052,05467540,n,10,(chemistry) variability in chemical composition without variation in crystalline form,2111
137053,05467682,n,10,"contact by fitting together: ""the engagement of the clutch""; ""the meshing of gears""",
137054,05467854,n,10,"a light sharp contact (usually with something flexible); ""he gave it a flick with his finger"" or ""he felt the flick of a whip""",
137055,05468032,n,10,the striking of one body against another,
137056,05468143,n,10,"an impact (as from a collision); ""the bump threw him off the bicycle""",
137057,05468378,n,10,"a sudden impact: ""the door closed with a jolt""",
137058,05468490,n,10,"the physical coming together of two or more things: ""contact with the pier scraped paint from the hull""",
137059,05468760,n,10,loss of military equipment,1781
137060,05468896,n,10,loss of military equipment in battle,1781
137061,05469010,n,10,loss of military equipment in field operations,1781
137062,05469144,n,10,a decrease of military personnel or equipment,1781
137063,05469280,n,10,a casualty to military personnel resulting from combat,1781
137064,05469447,n,10,a wound that would cause an English soldier to be sent home from service abroad,1781
137065,05469586,n,10,a wound that does not damage important internal organs or shatter any bones,1781
137066,05469719,n,10,military personnel lost by death or capture,1781
137067,05469870,n,10,"personnel that are sacrificed (e.g., surrendered or lost in order to gain an objective)",1781
137068,05470013,n,10,"a single complete execution of a periodically repeated phenomenon: ""a year constitutes a cycle of the seasons""",
137069,05470229,n,10,"the complete cycle of events in the heart from the beginning of one heart beat to the beginning of the next; an electrical impulse in conducted through the heart muscle that constricts the atria which is followed by constriction of the ventricles: ""the cardiac cycle can be shown on an electrocardiogram""",
137070,05470593,n,10,"one complete cycle of operations (as by a computer); ""it was not possible to complete the computation in a single pass""",
137071,05470763,n,10,"an event that repeats: ""the events today were a repeat of yesterday's""",
137072,05470971,n,10,several repetitions of a melodic phrase in different keys,
137073,05471083,n,10,"a periodically repeated sequence of events: ""a cycle of reprisal and retaliation""",
137074,05471216,n,10,something (especially a game) that is played again,
137075,05471329,n,10,"happening again (especially at regular intervals); ""the return of spring""",
137076,05471504,n,10,a reappearance of an earlier characteristic,2188
137077,05471625,n,10,an unexpected but vivid recurrence of a past experience (especially a recurrence of the effects of an hallucinogenic drug taken much earlier),
137078,05471822,n,10,the daily event of the sun rising above the horizon,
137079,05471927,n,10,the daily event of the sun sinking below the horizon,
137080,05472032,n,10,a broad and deep undulation of the ocean,
137081,05472145,n,10,waves breaking on the shore,
137082,05472244,n,10,"the wave that spreads behind a boat as it moves forward: ""the motorboat's wake capsized the canoe""",
137083,05472404,n,10,"the movement or sound of water: ""the swash of waves on the beach""",
137084,05472521,n,10,a small wave on the surface of a liquid,
137085,05472643,n,10,(physics) a wave that is hypothesized to propagate gravity and to travel at the speed of light,2097
137086,05472815,n,10,a wave whose waveform resembles a sine curve,2097
137087,05472915,n,10,(physics) a regular variation in value about a mean,2097
137088,05473126,n,10,(electronics) an oscillation of small amplitude imposed on top of a steady value,2284
137089,05473259,n,10,(physics) a progressive disturbance propagated without displacement of the medium itself,2097
137090,05473610,n,10,"a wave motion: ""the fluctuations of the sea""",2097
137091,05473712,n,10,a wave on the surface of a lake or landlocked bay; caused by atmospheric or seismic disturbances,2097
137092,05473861,n,10,a wave (as a sound wave in a chamber or an electromagnetic wave in a transmission line) in which the ratio of its instantaneous amplitude at one point to that at any other point does not vary with time,2097
137093,05474140,n,10,(acoustics) a wave that transmits sound,2101
137094,05474254,n,10,a sound wave that is transmitted via air,2101
137095,05474349,n,10,(physics) a short-lived oscillation in a system caused by a sudden change of voltage or current or load,2097
137096,05474508,n,10,the shape of a wave illustrated graphically by plotting the values of the period quantity against time,2097
137097,05474690,n,10,a region of high pressure travelling through a gas at a high velocity,
137098,05474834,n,10,"an explosive sound caused by the shock wave of an airplane traveling faster than the speed of sound: ""a sonic boom follows an aircraft as a wake follows a ship""",
137099,05475051,n,10,the undulating movement of the surface of the open sea,
137100,05475192,n,10,a wave that lifts the surface of the water or ground,
137101,05475302,n,10,a large sea wave,
137102,05475379,n,10,a huge destructive wave (especially one caused by an earthquake),
137103,05475510,n,10,a long heavy sea wave as it advances towards the shore,
137104,05475639,n,10,a periodic motion in which the displacement is either symmetrical about a point or is the sum of such motions,
137105,05475828,n,10,(geology) a horizontal dislocation,2121
137106,05475914,n,10,a movement back from an impact,
137107,05476069,n,10,rebounding from an impact (or series of impacts),
137108,05476181,n,10,the backward jerk of a gun when it is fired,
137109,05476284,n,10,(computer science) the movement of a read/write head to a specific data track on a disk,1355
137110,05476422,n,10,"a twisting squeeze: ""gave the wet cloth a wring""",
137111,05476532,n,10,the maximum movement available to a pivoted or reciprocating piece by a cam,
137112,05476717,n,10,the stroke of an engine piston moving away from the crankshaft,
137113,05476834,n,10,the stroke of an engine piston moving toward the crankshaft,
137114,05476949,n,10,"a movement in a new direction: ""the turning of the wind""",
137115,05477156,n,10,a jerky pulling movement,
137116,05477241,n,10,one of a series of ridges that moves across the surface of a liquid (especially across a large body of water),
137117,05477614,n,10,a wave that is blown by the wind so its crest is broken and appears white,
137118,05477756,n,10,"something that rises rapidly and dies away: ""a wave of emotion swept over him""; ""there was a sudden wave of buying before the market closed""",
137119,05477947,n,10,an accident that destroys a ship at sea,1942
137120,05478068,n,10,(nautical) the event of a boat accidentally turning over in the water,1942
137121,05478207,n,10,"the ending of a contest (as a race); ""it was an exciting finish""; ""I didn't stay for the close of the tournament""",
137122,05478453,n,10,"a finish in first place (as in a race or other competition); ""he was happy to get the win""",
137123,05478593,n,10,(in horse racing) a finish in second place,2651
137124,05478687,n,10,(in horse racing) a finish in third place,2651
137125,05478779,n,10,the concluding part of any performance,
137126,05478896,n,10,"the ending of a series or sequence: ""the Alpha and the Omega, the first and the last, the beginning and the end""-Revelation",
137127,05479076,n,10,"the event of dying or departure from life: ""her death came as a terrible shock""; ""upon your decease the capital will pass to your grandchildren""",
137128,05479408,n,10,"a change downward: ""there was a sharp drop-off in sales""",
137129,05479668,n,10,"a slow fall or decline (as for lack of strength); ""after several hours of sinking an unexpected rally rescued the market""; ""he could not control the sinking of his legs""",
137130,05479891,n,10,"a change resulting in an increase: ""the fare increase is scheduled for next month""",
137131,05480118,n,10,"a wearing down to weaken or destroy: ""a war of attrition""",
137132,05480231,n,10,a change for the better,
137133,05480347,n,10,a change for the better; progress in development,
137134,05480566,n,10,"the result of improving something: ""he described a refinement of this technique""",
137135,05480717,n,10,alteration in the shape or dimensions of an object as a result of the application of stress to it,
137136,05480908,n,10,a change from one place or state or subject or stage to another,
137137,05481064,n,10,"an obvious change of public opinion or political sentiment that occurs without leadership or overt expression: ""there was a ground swell of antiwar sentiment""",
137138,05481281,n,10,"an abrupt transition: ""a successful leap from college to the major leagues""",
137139,05481414,n,10,a qualitative change,
137140,05481681,n,10,a change in the relative numbers of the different groups of individuals making up a population,
137141,05481838,n,10,(chemistry) a change directly from the solid to the gaseous state without becoming liquid,2111
137142,05481985,n,10,the transformation of ordinary white tin into powdery gray tin a very cold temperatures,
137143,05482154,n,10,an incident is which an infectious disease is transmitted,2232
137144,05482294,n,10,"an incident (real or imaginary); ""their parting was a sad scene""",
137145,05482410,n,10,"a subordinate incident of little importance relative to the main event: ""instruction is not an educational sideshow""",
137146,05482581,n,10,a mishap caused by something suddenly falling down or caving in,
167862,10751084,n,10,a salt of phosphoric acid,2111
137147,05482753,n,10,the sudden collapse of something into a hollow beneath it,
137148,05482877,n,10,an event that causes someone to die,
137149,05482982,n,10,an accident that causes someone to die,
137150,05483110,n,10,"a stopping: ""a cessation of the thunder""",
137151,05483217,n,10,a gradual sinking to a lower level,
137152,05483331,n,10,"a descent as through liquid (especially through water); ""they still talk about the sinking of the Titanic""",
137153,05483545,n,10,"a free and rapid descent by the force of gravity: ""it was a miracle that he survived the drop from that height""",
137154,05483742,n,10,a movement downward,
137155,05483905,n,10,"a sudden downpour (as of tears or sparks etc) likened to a rain shower; ""a little shower of rose petals""",
137156,05484062,n,10,"the descent of a heavenly body below the horizon: ""before the set of sun""",
137157,05484185,n,10,covering completely with water,
137158,05484329,n,10,a brief immersion,
137159,05484396,n,10,(of a ship) sinking,1942
137160,05484486,n,10,a rocking motion,
137161,05484555,n,10,"a complete failure: ""the play was a dismal flop""",
137162,05484679,n,10,"an event that fails badly or is totally ineffectual: ""the first experiment was a real turkey""; ""the meeting was a dud as far as new business was concerned""",
137163,05484900,n,10,a sudden and violent collapse,
137164,05484992,n,10,"a sudden inward collapse: ""the implosion of a light bulb""",
137165,05485105,n,10,"the event of something ending: ""it came to a stop at the bottom of the hill""",1946
137166,05485275,n,10,an interruption of normal activity,
137167,05485383,n,10,"a variation that deviates from the standard or norm: ""the deviation from the mean""",
137168,05485595,n,10,an event that departs from expectations,
137169,05485713,n,10,the deviation (by a vessel or aircraft) from its intended course due to drifting,
137170,05485848,n,10,something abnormal or anomalous,
137171,05485970,n,10,"something hideous or frightful: ""they regarded the atom bomb as a monstrosity""",
137172,05486106,n,10,an event that results in a displacement or discontinuity,
137173,05486233,n,10,"the occurrence of breaking: ""the break in the dam threatened the valley""",
137174,05486357,n,10,"some occurrence that interrupts: ""the telephone is an annoying interruption""; ""there was a break in the action when a player was hurt""",
137175,05486628,n,10,an interruption in the intensity or amount of something,
137176,05486800,n,10,one celestial body obscures another,2076
137177,05486961,n,10,the moon interrupts light from the sun,2076
137178,05487077,n,10,the earth interrupts light shining on the moon,2076
137179,05487183,n,10,only a thin outer disk of the sun can be seen,2076
137180,05487290,n,10,an eclipse as seen from a place where the eclipsed body is completely obscured,2076
137181,05487428,n,10,an eclipse in which the eclipsed body is only partially obscured,2076
137182,05487554,n,10,the amount by which something increases,
137183,05487652,n,10,making or becoming suitable; adjusting to circumstances,1787
137184,05487790,n,10,"a movement upward: ""they cheered the rise of the hot-air balloon""",
137185,05488098,n,10,"a movement downward: ""the rise and fall of the tides""",
137186,05488220,n,10,an event that involves rising to a higher point (as in altitude or temperature or intensity etc.),
137187,05488391,n,10,the event of something being raised,
137188,05488499,n,10,"an upward movement (especially a rhythmical rising and falling); ""the heaving of waves on a rough sea""",
137189,05488663,n,10,the initial ascent of a rocket from its launching pad,
137190,05488770,n,10,"the sudden occurrence of an audible event: ""the sound awakened them""",
137191,05489772,n,10,"an angry disturbance: ""he didn't want to make a fuss""; ""they had labor trouble""; ""a spot of bother""",
137192,05489950,n,10,"a movement forward: ""he listened for the progress of the troops""",
137193,05490111,n,10,"forward movement: ""the ship made little headway against the gale""",
137194,05490237,n,10,"an annoying or frustrating event: ""his mother-in-law's visits were a great trial for him""; ""life is full of tribulations""; ""a visitation of the plague""",
137195,05490485,n,10,"the occurrence of a uniting of separate parts: ""lightning produced an unusual union of the metals""",
137196,05490689,n,10,union of sperm and egg in sexual reproduction,2158
137197,05490810,n,10,an occurrence that involves the production of a union,
137198,05490939,n,10,an occurrence that results in things being combined,
137199,05491124,n,10,combining into a solid mass,
137200,05491211,n,10,"an event that combines things in a mixture: ""a gradual mixture of cultures""",
137201,05491382,n,10,an occurrence of an unusual mixture,
137202,05491474,n,10,an occurrence combining miscellaneous things,
137203,05491579,n,10,an occurrence of thorough mixing,
137204,05491663,n,10,a rapid rise,
137205,05491755,n,10,the initial ascent of an airplane as it becomes airborne,
137206,05491865,n,10,(geology) a rise of land to a higher elevation (as in the process of mountain building),2121
137207,05492038,n,10,"the rising of something: ""the coulds"" uplifting revealed the blue of a summer sky""",
137208,05492176,n,10,the cry made by sheep,
137209,05492247,n,10,a sudden very loud noise,
137210,05492388,n,10,a continuing very loud noise,
137211,05492470,n,10,the sound made by a dog,
137212,05492562,n,10,a noise resembling the bark of a dog,
137213,05492649,n,10,the sound of a hound on the scent,
137214,05492732,n,10,"the sound of stroke or blow: ""he heard the beat of a drum""",
137215,05492841,n,10,a short high tone produced as a signal or warning,
137216,05492949,n,10,"the sound of a bell: ""saved by the bell""",
137217,05493076,n,10,a loud harsh or strident noise,
137218,05493195,n,10,a deep prolonged loud noise,
137219,05493300,n,10,the sound of sheep or goats (or any sound resembling this),
137220,05493410,n,10,the cry of an ass,
137221,05493478,n,10,the bark of a dog,
137222,05493549,n,10,"sound of rapid vibration: ""the buzz of a bee""",
137223,05493645,n,10,the sound made by a hen after laying an egg,
137224,05493741,n,10,the yowling sound made by a cat in heat,
137225,05493836,n,10,the sound made by corvine birds,
137226,05493917,n,10,the high-pitched continuing noise made by animals (birds or monkeys),
137227,05494052,n,10,the rapid series of noises made by the parts of a machine,
137228,05494176,n,10,the short weak cry of a young bird,
137229,05494269,n,10,a short light metallic sound,
137230,05494365,n,10,a sharp sound made by small birds or insects,
137231,05494479,n,10,a series of chirps,
137232,05494561,n,10,"any utterance produced simultaneously by a group: ""a chorus of boos""",
137233,05494682,n,10,the dull explosive noise made by an engine,
137234,05494775,n,10,"a loud resonant repeating noise: ""he could hear the clang of distant bells""",
137235,05494969,n,10,"a rattling noise (often produced by rapid movement); ""the shutters clattered against the house""; ""the clatter of iron wheels on cobblestones""",
137236,05495164,n,10,a succession of clicks,
137237,05495262,n,10,"a fast and rhythmic click-clack; ""the clickety-clack of the typewriters""",
137238,05495412,n,10,the sound made by a hen (as in calling her chicks),
137239,05495514,n,10,an imitation of the crow of a cock,
137240,05495612,n,10,the sound made by a pigeon,
