134244,05045651,n,10,"an assertion of a right (as to money or property); ""his claim asked for damages""",
134245,05045783,n,10,"an assertion that something is true or factual: ""his claim that he was innocent""; ""evidence contradicted the government's claims""",
134246,05045982,n,10,"an assertion that someone is guilty of a fault or offence: ""the newspaper published charges that Jones was guilty of drunken driving""",
134247,05046181,n,10,statements affirming or denying certain matters of fact,
134248,05046324,n,10,a point asserted as part of an argument,
134249,05046420,n,10,an unsupported assertion,
134250,05046501,n,10,a group of symbols that make a mathematical statement,2873
134251,05046657,n,10,a conventionalized statement expressing some fundamental principle,
134252,05046777,n,10,a statement of a mathematical relation,2873
134253,05046939,n,10,a statement asserting the existence or the truth of something,
134254,05047103,n,10,"an assertion offering firsthand authentication of a fact: ""according to his own testimony he can't do it""",
134255,05047264,n,10,"an open avowal (true or false) of some belief or opinion; ""a profession of disagreement""",
134256,05047422,n,10,a strong declaration of protest,
134257,05047512,n,10,a declaration of something self-evident; something that can be assumed as the basis for argument,
134258,05047680,n,10,"declaration of an intention or a determination to inflict harm on another: ""his threat to kill me was quite explicit""",
134259,05047886,n,10,a threat of divine punishment or vengeance,
134260,05047986,n,10,"a threat or the act of threatening: ""he spoke with desperate menace""",
134261,05048107,n,10,(law) all the means by which any alleged matter of fact whose truth is investigated at judicial trial is established or disproved,1802
134262,05048417,n,10,an object or statement produced before a court of law and referred to while giving evidence,1802
134263,05048562,n,10,a solemn statement made under oath,1802
134264,05048706,n,10,testimony by word or deed to your religious faith,1802
134265,05048809,n,10,the body of evidence that constitute the offence; the objective proof that a crime has been committed (sometimes mistakenly thought to refer to the body of a homicide victim),1802
134266,05049044,n,10,evidence (usually the testimony of a witness) directly related to the fact in dispute,1802
134267,05049209,n,10,evidence providing only a basis for inference about the fact in dispute,1802
134268,05049388,n,10,evidence based on what someone has told the witness and not of direct knowledge,1802
134269,05049531,n,10,evidence for the prosecution in criminal proceedings,1802
134270,05049646,n,10,unsworn statement in a legal transaction,1802
134271,05049744,n,10,written declaration made under oath,1802
134272,05049880,n,10,(bridge) the number of tricks a bridge player is willing to contract to make,2637
134273,05050089,n,10,(bridge) the highest bid becomes the contract setting the number of tricks that the bidder must make,2637
134274,05050263,n,10,(bridge) a bid that asks your partner to bid another suit,2637
134275,05050374,n,10,(bridge) a bid that is higher than your opponent's bid (especially when your partner has not bid at all and your bid exceeds the value of your hand),2637
134276,05050587,n,10,"a brief statement: ""he didn't say a word about it""",
134277,05050688,n,10,"a statement that explains: ""he launched into a detailed explanation""; ""he demanded that I give an account for my failure""",
134278,05051021,n,10,"a convincing explanation that reveals basic causes: ""he was unable to give a clear accounting for his actions""",
134279,05051188,n,10,a statement of the desirability of something,
134280,05051294,n,10,"a statement of facts and reasons made in appealing or protesting: ""certain representations were made concerning police brutality""",
134281,05051484,n,10,"an explanation of the cause of some phenomenon: ""the reason a steady state was never reached was that the back pressure built up too slowly""",
134282,05051677,n,10,a statement in explanation of some action or belief,
134283,05051824,n,10,"a justification for something existing or happening: ""he had no cause to complain""; ""they had good reason to rejoice""",
134284,05052012,n,10,"the justification for some act or belief: ""he offered a persuasive defense of the theory""",
134285,05052233,n,10,a formal written defense of something you believe in strongly,
134286,05052359,n,10,(law) a defense by an accused person purporting to show that he or she could not have committed the crime in question,1802
134287,05052528,n,10,"a defense of some offensive behavior or some failure to keep a promise etc: ""he kept finding excuses to stay""; ""every day he had a new alibi for not getting a job""; ""his transparent self-justification was unacceptable""",
134288,05052829,n,10,an interpretation of the meaning of something,
134289,05052974,n,10,the exposition (often superficially) of a particular philosophy,
134290,05053116,n,10,the exposition (often superficially) of a particular moral code,
134291,05053236,n,10,an explanation of the meaning of something,
134292,05053336,n,10,"a statement that solves a problem or explains how to solve the problem: ""they were trying to find a peaceful solution""; ""the answers were in the back of the book""; ""he computed the result to four decimal places""",
134293,05053651,n,10,the final resolution of the main complication of a literary or dramatic work,
134294,05053784,n,10,an explanation or definition of an obscure word in a text,
134295,05053902,n,10,(historical linguistics) an explanation of the historical origins of a word or phrase,1969
134296,05054071,n,10,a concise explanation of the meaning of a word or phrase or symbol,
134297,05054320,n,10,"a definition in which the term is used by embedding it in a larger expression containing its explanation; for example, ""legal duty"" might be defined contextually: ""X has a legal duty to do Y means that X is required to do Y by a contract relationship that would be upheld in a court of law""",
134298,05054678,n,10,a definition that reports the standard uses of a word or phrase or symbol,
134299,05054819,n,10,a definition that gives an exact equivalent of the term defined,
134300,05054948,n,10,a definition that points out or exhibits instances of the term defined,
134301,05055085,n,10,(mathematics) a definition of a function from which values of the function can be calculated in a finite number of steps,2873
134302,05055272,n,10,a new definition,
134303,05055347,n,10,a definition that is stipulated by someone and that is not a standard usage,
134304,05055491,n,10,"a statement (either spoken or written) that is made in reply to a question or request or criticism or accusation; ""I waited several days for his answer""; ""he wrote replies to several of his critics""",
134305,05055797,n,10,a reply by a Pope to an inquiry concerning a point of law or morality,1565
134306,05055921,n,10,response to an inquiry or experiment,
134307,05056012,n,10,"a statement about something that is happening or going to happen: ""the announcement appeared in the local newspaper""",
134308,05056313,n,10,(in Christian religions) the announcement to the Virgin Mary by the angel Gabriel of the incarnation of Christ,1565
134309,05056482,n,10,a public announcement (in church) of a proposed marriage,1565
134310,05056590,n,10,an announcement distributed to members of the press in order to supplement or replace an oral presentation,
134311,05056776,n,10,"an announcement containing information about a future event: ""you didn't give me enough notice""",
134312,05056942,n,10,"(law) a formal notice filed with a court or officer to suspend a proceeding until filer is given a hearing: ""a caveat filed against the probate of a will""",1802
134313,05057149,n,10,a notice of someone's death; usually includes a short biography,
134314,05057286,n,10,"an announcement of the events that will occur as part of a theatrical or sporting event: ""you can't tell the players without a program""",
134315,05057523,n,10,a list of particulars (as a playbill or bill of fare),
134316,05057663,n,10,"a theatrical program: ""he couldn't find her name on the playbill""",
134317,05057801,n,10,a program for a race meeting; lists the races and the names of the horses,
134318,05057929,n,10,a statement about the future,
134319,05058114,n,10,a prediction uttered under divine inspiration,
134320,05058245,n,10,a prophecy (usually obscure or allegorical) revealed by a priest or priestess; believed to be infallible,
134321,05058402,n,10,predicting what the weather will be,
134322,05058536,n,10,a prediction about how something (as the weather) will develop,
134323,05058665,n,10,a prediction of someone's future based on the relative positions of the planets,
134324,05058800,n,10,(logic) a statement that affirms or denies something and is either true or false,"1451,2873"
134325,05059065,n,10,two propositions are contradictories if both cannot be true (or both cannot be false) at the same time,"1451,2873"
134326,05059227,n,10,two propositions are contraries if both cannot be true but both can be false,"1451,2873"
134327,05059358,n,10,(logic) a proposition obtained by conversion,"1451,2873"
134328,05059457,n,10,a subsidiary proposition that is assumed to be true in order to prove another proposition,"1451,2873"
134329,05059598,n,10,"one of the substantive phrases in a logical proposition: ""the major term of a syllogism must occur twice""","1451,1974,2873"
134330,05059863,n,10,a proposition deducible from basic postulates,"1451,2873"
134331,05059980,n,10,the proposition that must follow from the major and minor premises of a syllogism,"1451,2873"
134332,05060175,n,10,in logic: a proposition that is accepted as true in order to provide a basis for logical reasoning,"1451,2873"
134333,05060347,n,10,in logic: a proposition that is not susceptible of proof or disproof; its truth is assumed to be self-evident,"1451,2873"
134334,05060508,n,10,"a statement that is assumed to be true and from which a conclusion can be drawn: ""on the assumption that he has been injured we can infer that he will not to play""","1451,2873"
134335,05060820,n,10,the premise of a syllogism that contains the major term (which is the predicate of the conclusion),"1451,2873"
134336,05061051,n,10,the premise of a syllogism that contains the minor term (which is the subject of the conclusion),"1451,2873"
134337,05061280,n,10,the term in a syllogism that is the predicate of the conclusion,"1451,1969,2873"
134338,05061438,n,10,the term in a syllogism that is the subject of the conclusion,"1451,1969,2873"
134339,05061594,n,10,the term in a syllogism that is common to both premises and excluded from the conclusion,"1451,1969,2873"
134340,05061778,n,10,an argument that appears good at first view but is really fallacious,
134341,05061964,n,10,an argument that assumes that which is to be proved,
134342,05062076,n,10,an unproved statement put forward as a premise in an argument,"1451,2873"
134343,05062190,n,10,an assumption on which rests the validity or effect of something else,2873
134344,05062380,n,10,(math) a condition specified for the solution to a set of differential equations,2873
134345,05062525,n,10,"a stipulated condition: ""he accepted subject to one provision""",2873
134346,05062653,n,10,a false statement,
134347,05062872,n,10,a statement that evades the question by cleverness or trickery,
134348,05063005,n,10,a statement that deviates from or perverts the truth,
134349,05063177,n,10,"a trivial lie: ""he told a fib about eating his spinach""; ""how can I stop my child from telling stories?""",
134350,05063391,n,10,an interesting but highly implausible story; often told as an excuse,
134351,05063568,n,10,a false boast that can harm others; especially a false claim to be married to someone (formerly actionable at law),
134352,05063740,n,10,a gross untruth,
134353,05063809,n,10,a deliberately false or improbable account,
134354,05063945,n,10,a deliberately misleading fabrication,
134355,05064035,n,10,a misleading falsehood,
134356,05064304,n,10,a partially true statement intended to deceive or mislead,
134357,05064418,n,10,a showy misrepresentation intended to conceal something unpleasant,
134358,05064555,n,10,making to seem more important than it really is,
134359,05064711,n,10,a statement that is restrained in ironic contrast to what might have been said,
134360,05064886,n,10,"an understatement that expresses an affirmative thought negatively: ""printing wasn't a bad idea""",
134361,05065035,n,10,a long and elaborate misrepresentation,
134362,05065128,n,10,pretending with intention to deceive,
134363,05065298,n,10,"pretense that your position is stronger than it really is: ""his bluff succeeded in getting him accepted""",
134364,05065454,n,10,something serving to conceal plans; a fictitious reason that is concocted in order to conceal the real reason,
134365,05065634,n,10,an expression of agreement that is not supported by real conviction,
134366,05065771,n,10,"something intended to misrepresent the true nature of an activity: ""he wasn't sick--it was just a subterfuge""; ""the holding company was just a blind""",
134367,05065985,n,10,verbal misrepresentation intended to take advantage of you in some way,
134368,05066196,n,10,a fraudulent or duplicitous representation,
134369,05066308,n,10,a statement that is not literally false but that cleverly avoids an unpleasant truth,
134370,05066533,n,10,an indirect way of expressing something,
134371,05066655,n,10,any language that pretends to communicate but actually does not,
134372,05066776,n,10,an intentionally noncommittal or ambiguous statement,
134373,05066890,n,10,an evasion of the point of an argument by raising irrelevant distinctions or objections,
134374,05067031,n,10,an equivocal qualification; a word used to avoid making an outright assertion,
134375,05067166,n,10,"a statement that limits or restricts some claim: ""he recommended her without any reservations""",
134376,05067352,n,10,a statement made with careful qualifications,
134377,05067461,n,10,"a written explanation or criticism or illustration that is added to a book or other textual material: ""he wrote an extended comment on the proposal""",
134378,05067694,n,10,"a comment (usually added to a text); ""his notes were appended at the end of the article""",
134379,05067911,n,10,a note placed below the text on a printed page,
134380,05068012,n,10,"a short note acknowledging a source of information or quoting a passage: ""the student's essay failed to list several important citations""; ""the article includes mention of similar clinical cases""",
134381,05068341,n,10,a note acknowledging the source of a published photograph,
134382,05068457,n,10,a reference at one place in a work to information at another place in the same work,
134383,05068616,n,10,"a statement that expresses a personal opinion or belief: ""from time to time she contributed a personal comment on his account""",
134384,05068949,n,10,an opening remark intended to secure an advantage for the speaker,
134385,05069074,n,10,an opinion voiced by a judge on a point of law not directly bearing on the case in question and therefore not binding,1802
134386,05069260,n,10,an incidental remark,
134387,05069358,n,10,"a remark that calls attention to something or someone: ""she made frequent mention of her promotion""; ""there was no mention of it""; ""the speaker made several references to his wife""",
134388,05069640,n,10,passing reference or indirect mention,
134389,05069732,n,10,the practice of casually mentioning important people in order to impress your listener,
134390,05069878,n,10,a remark expressing careful consideration,
134391,05070038,n,10,C. Northcote Parkinson's cynical observation that the number of subordinates in an organization will increase linearly regardless of the amount of work to be done,
134392,05070262,n,10,C. Northcote Parkinson's cynical observation that work will expand so as to fill the time available for its completion,
134393,05070442,n,10,witty remark,
134394,05070533,n,10,"an aggressive remark directed at a person like a missile and intended to have a telling effect: ""his parting shot was ""drop dead""""; ""she threw shafts of sarcasm""; ""she takes a dig at me every chance she gets""",
134395,05070834,n,10,"a statement that is formulated as a question but that is not supposed to be answered: ""he liked to make his points with rhetorical questions""",
134396,05071041,n,10,a statement that contains a mistake,
134397,05071189,n,10,a revised statement,
134398,05071302,n,10,the restatement of a message (as a religious one) in rational terms,1566
134399,05071453,n,10,the restatement of a message as a myth,1566
134400,05071571,n,10,"part of a statement that is not correct: ""the book was full of errors""",
134401,05071739,n,10,a printer's error; to be corrected,
134402,05071831,n,10,a mistake in printed matter resulting from mechanical failures of some kind,
134403,05072026,n,10,the unintentional misuse of a word by confusion with one that sounds similar,
134404,05072171,n,10,an accidental and usually trivial mistake in speaking,
134405,05072307,n,10,transposition of initial consonants in a pair of words,
134406,05072418,n,10,"the statement (oral or written) of an exchange of promises; ""they had an agreement that they would not interfere in each other's business""; ""there was an understanding between management and the workers""",1753
134407,05072928,n,10,"(usually plural) a statement of what is required as part of an agreement; ""the contract set out the conditons of the lease""; ""the terms of the treaty were generous""",1753
134408,05073174,n,10,"an agreement between parties (usually arrived at after discussion) fixing obligations of each; ""he made a bargain with the devil""; ""he rose to prominence through a series of shady deals""",
134409,05073421,n,10,an informal agreement to work together,
134410,05073523,n,10,a personal agreement based on honor and not legally binding,
134411,05073650,n,10,a legal document summarizing the agreement between parties,1802
134412,05073898,n,10,a signed written agreement between two or more parties (nations) to perform some action,1802
134413,05074062,n,10,a friendly understanding between political powers,
134414,05074184,n,10,an agreement that is not in writing and is not signed by the parties but is a real existing contract that lacks only the formal requirement of a memorandum to render it enforceable in litigation,
134415,05074438,n,10,a contract binding one party into the service of another for a specified term,"1753,1802"
134416,05074571,n,10,formal agreement between the issuer of bonds and the bondholders as to terms of the debt,1802
134417,05074715,n,10,a legal agreement specifying a payment or action and the penalty for failure to comply,1802
134418,05074858,n,10,a written agreement between two states or sovereigns,"1802,2768"
134419,05075069,n,10,a formal agreement establishing an association or alliance between nations or other groups to achieve a particular aim,"1802,2768"
134420,05075242,n,10,"a treaty to cease hostilities: ""peace came on November 11th""","1802,2768"
134421,05075369,n,10,(diplomacy) an international agreement,1749
134422,05075482,n,10,an agreement concerning the treatment of war prisoners,1749
134423,05075600,n,10,the first treaty between the US and USSR resulting from the Strategic Arms Limitation Talks,"1802,2768"
134424,05075744,n,10,the second treaty between the US and USSR resulting from the Strategic Arms Limitation Talks,"1802,2768"
134425,05075890,n,10,a message whose ingenuity or verbal skill or incongruity has the power to evoke laughter,
134426,05076231,n,10,a witty comment or writing,
134427,05076316,n,10,a clever remark,
134428,05076385,n,10,"witty language used to convey insults or scorn: ""he used sarcasm to upset his opponent""; ""irony is wasted on the stupid""",
134429,05076629,n,10,adroitness and cleverness in reply,
134430,05076736,n,10,light teasing repartee,
134431,05076885,n,10,frivolous banter,
134432,05076956,n,10,light teasing,
134433,05077026,n,10,a humorous anecdote or remark,
134434,05077312,n,10,the point of a joke or humorous story,1969
134435,05077460,n,10,a joke that seems extremely funny,
134436,05077613,n,10,an indelicate joke,
134437,05077727,n,10,a joke at the expense of some ethnic group,
134438,05077827,n,10,an account of an amusing incident (usually with a punch line),
134439,05077959,n,10,a one-line joke,
134440,05078030,n,10,a long rambling joke whose humor derives from its pointlessness,
134441,05078156,n,10,a joke in bad taste,
134442,05078231,n,10,a joke whose effect is achieved by visual means rather than by speech (as in a movie),
134443,05078386,n,10,a representation of a person that is exaggerated for comic effect,
134444,05078554,n,10,a composition that imitates somebody's style in a humorous way,
134445,05078762,n,10,a humorous or satirical drawing published in a newspaper or magazine,1422
134446,05078930,n,10,"verbal wit (often at another's expense but not to be taken seriously); ""he became a figure of fun""",
134447,05079165,n,10,fun characterized by humor,
134448,05079259,n,10,waggish behavior,
134449,05079343,n,10,a comic incident or series of incidents,
134450,05079469,n,10,"a humorous play on words: ""I do it for the pun of it""",
134451,05079593,n,10,ribald humor,
134452,05079660,n,10,"a message expressing a belief about something: ""his opinions appeared frequently on the editorial page""",
134453,05079860,n,10,a message expressing an opinion based on incomplete evidence,
134454,05080036,n,10,"an opinion that is held in opposition to another in an argument or dispute: ""there are two sides to every question""",
134455,05080213,n,10,"an imprecise or incomplete account: ""newspapers gave only an approximation of the actual events""",
134456,05080369,n,10,"a statement indicating the likely cost of some job: ""he got an estimate from the car repair shop""",
134457,05080521,n,10,"the subject matter at issue: ""the question of disease merits serious discussion""; ""under the head of minor Roman poets""",
134458,05080756,n,10,"a question raised for consideration or solution: ""our homework consisted of ten problems to solve""",
134459,05081088,n,10,a disputed factual contention that is generally left for a jury to decide,
134460,05081241,n,10,a disputed legal contention that is generally left for a judge to decide,1802
134461,05081391,n,10,"a particularly baffling problem: ""That's a real puzzler""",
134462,05081510,n,10,"a problem requiring investigation: ""Perry Mason solved the case of the missing heir""",
134463,05081645,n,10,a problem that students are assigned to do outside of class,
134464,05081767,n,10,a difficult problem,
134465,05081875,n,10,a particularly difficult or baffling question or problem,
134466,05082003,n,10,any very difficult problem; insoluble in its own terms,
134467,05082116,n,10,a puzzle in which words corresponding to numbered clues are to be found and written in to squares in the puzzle,
134468,05082302,n,10,a puzzle where you fill a square grid with words reading the same down as across,
134469,05082451,n,10,a problem that severely tests the ability of an inexperienced person,
134470,05082579,n,10,a puzzle where you decode a message consisting of pictures representing syllables and words,
134471,05082722,n,10,"a message describing how something is to be done: ""he gave directions faster than she could follow them""",
134472,05083076,n,10,incorrect directions or instructions,
134473,05083171,n,10,written directions for finding some location; written on letters or packages that are to be delivered to that location,1934
134474,05083450,n,10,the address of the sender of a letter or parcel indicating where it should be returned if it cannot be delivered,
134475,05083623,n,10,detailed stylistic instructions for typesetting something that is to be printed; manual markup is usually written on the copy (e.g. underlining words that are to be set in italics),
134476,05083856,n,10,a set of symbols and rules for their use when doing a markup of a document,"1355,1969"
134477,05084028,n,10,(computer science) a standardized language for the descriptive markup of documents; a set of rules for using whatever markup vocabulary is adopted,1355
134478,05084264,n,10,a set of tags and rules (conforming to SGML) for using them in developing hypertext documents,1355
134479,05084436,n,10,directions for achieving a therapeutic effect,
134480,05084540,n,10,directions for making something,
134481,05084634,n,10,"directions that define the way a game or sport is to be conducted: ""he knew the rules of chess""","2633,2638"
134482,05084798,n,10,an instruction written as part of the script of a play,"2610,2657"
134483,05084933,n,10,the body of teachings of a religious group that are generally accepted by that group,1565
134484,05085207,n,10,a formal creed summarizing Christian beliefs,1565
134485,05085310,n,10,a religious doctrine that is proclaimed as true without proof,1565
134486,05085440,n,10,the Roman Catholic doctrine that the Virgin Mary was conceived without any stain of original sin,1565
134487,05085604,n,10,the Christian doctrine of the union of God and man in the person of Jesus Christ,1565
134488,05085742,n,10,the Christian doctrine that the body of Christ is actually present in the Eucharist,1565
134489,05085885,n,10,"any communication that encodes a message: ""signals from the boat sudddenly stopped""",
134490,05086526,n,10,"a signal to begin (as in a race); ""the starting signal was a green light""; ""the runners awaited the start""",
