133705,04960176,n,10,a passage or expression that is quoted,"1565,2657"
133706,04960332,n,10,a quotation at the beginning of some piece of writing,"1565,2657"
133707,04960440,n,10,the representation of another person's words in a speech,"1565,2657"
133708,04960550,n,10,an incorrect quotation,"1565,2657"
133709,04960631,n,10,"a form of entertainment that enacts a story by a sequence of images giving the illusion of continuous movement: ""they went to a movie every Saturday night""; ""the film was shot on location""",1935
133710,04961237,n,10,a consecutive series of pictures that constitutes a unit of action in a film,"1935,2527"
133711,04961409,n,10,a scene that is filmed but is not used in the final editing of the film,2527
133712,04961534,n,10,"the principal (full-length) film in a program at a movie theater; ""the feature tonight is ""Casablanca""""",1935
133713,04961724,n,10,a film or illustrated lecture on traveling,"1935,2425"
133714,04961834,n,10,a film made at home by an amateur photographer,1935
133715,04961937,n,10,an entertainment that is offered to the public,"1935,2425"
133716,04962076,n,10,a rival attraction,"1935,2425"
162279,09846986,n,10,monetary unit in Albania,"1768,1951"
133717,04962158,n,10,a movie that is advertised to draw customers,1935
133718,04962266,n,10,a film about life in the western US during the period of exploration and development,1935
133719,04962418,n,10,a movie featuring shooting and violence,1935
133720,04962516,n,10,a brief film; often shown prior to showing the feature,1935
133721,04962666,n,10,a film made by photographing a series of cartoon drawings to give the illusion of movement when projected in rapid sequence,1935
133722,04962862,n,10,a short film and commentary about current events,1935
133723,04962965,n,10,a film or TV program presenting the facts about a person or event,1935
133724,04963134,n,10,a movie that shows ordinary people in actual activities without being controlled by a director,1935
133725,04963288,n,10,a short pornographic film shown in a small coin-operated booth,1935
133726,04963405,n,10,a movie without a soundtrack,1935
133727,04963492,n,10,a movie that apparently takes place at a slower than normal speed; achieved by taking the film at a faster rate,1935
133728,04963661,n,10,in films: a gradual transition from one scene to the next; the next scene is gradually superimposed as the former scene fades out,"1565,2657"
133729,04963845,n,10,"in films: an immediate transition from one shot to the next; ""the cut from the accident scene to the hospital seemed too abrupt""","1565,2657"
133730,04964041,n,10,in films: a transition from one scene to another,"1565,2657"
133731,04964140,n,10,an immediate transition from one scene to another,"1565,2657"
133732,04964244,n,10,a movie with synchronized speech and singing,1935
133733,04964359,n,10,a movie with images having three dimensional form or appearance,1935
133734,04964487,n,10,"a public exhibition or entertainment: ""they wanted to see some of the shows on Broadway""","1935,2425"
133735,04964806,n,10,"a radio or television show: ""did you see his program last night?""",1935
133736,04965111,n,10,a situation comedy,1935
133737,04965182,n,10,"a program devoted to news: ""we watch the 7 o'clock news every night""",1935
133738,04965328,n,10,"a program that is broadcast again: ""she like to watch ""I love Lucy"" reruns""",1935
133739,04965455,n,10,a program during which well-known people discuss a topic or answer questions telephoned in by the audience,1935
133740,04965635,n,10,a program in which the audience participates by telephone,1935
133741,04965747,n,10,a program broadcast by television,1935
133742,04965940,n,10,a program exemplifying a contemplated series; intended to attract sponsors,1935
133743,04966095,n,10,a television or radio program in which contestants compete for awards,1935
133744,04966249,n,10,a game show in which contestants answer questions,1935
133745,04966357,n,10,a strip of motion picture film used in a telecast,"1935,2527,2606"
133746,04966481,n,10,"a serialized set of programs: ""a comedey series""",1935
133747,04966646,n,10,an episode that ends in suspense,1935
133748,04966736,n,10,a part of a broadcast serial,1935
133749,04966882,n,10,a program without a commercial sponsor,1935
133750,04966985,n,10,a serialized program usually dealing with sentimentalized family matters that is broadcast on radio or television (frequently sponsored by a company advertising soap products),1935
133751,04967217,n,10,a series of four related works (plays or operas or novels),1935
133752,04967331,n,10,message that is transmitted by radio or television,1935
133753,04967491,n,10,a broadcast via radio,"1935,2606"
133754,04967574,n,10,a broadcast that is carried simultaneously by radio and television (or by FM and AM radio),1935
133755,04967720,n,10,a television broadcast,"1935,2606"
133756,04967816,n,10,a message transmitted by telegraph,1936
133757,04967966,n,10,a cheaper form of telegram sent for delivery the next day,1936
133758,04968082,n,10,the bags of letters and packages that are transported by the postal service,1934
133759,04968371,n,10,letters and packages that are transported by aircraft,1934
133760,04968478,n,10,mail that is sent by air transport,1934
133761,04968585,n,10,mail that is sent by land or sea,1934
133762,04968694,n,10,mail that is delivered by a special carrier (for an additional charge),"1753,1934"
133763,04968827,n,10,communication by the exchange of letters,
133764,04968965,n,10,"a written message addressed to a person or organization: ""wrote an indignant letter to the editor""",1934
133765,04969436,n,10,a note appended to a letter after the signature,1934
133766,04969564,n,10,a letter dealing with business,1934
133767,04969656,n,10,a hostile (usually anonymous) letter,1934
133768,04969751,n,10,a letter from the pope sent to all Roman Catholic bishops throughout the world,1934
133769,04969906,n,10,a letter dealing with personal affairs,1934
133770,04970042,n,10,a letter that is printed in multiple copies and mailed to a list of recipients,1934
133771,04970178,n,10,a letter of protest; addressed to one person but intended for the general public,1934
133772,04970316,n,10,a letter that is sent successively to several people,1934
133773,04970427,n,10,a letter from a pastor to the congregation,1934
133774,04970524,n,10,a letter signed by a number of people,1934
133775,04970619,n,10,a letter sent by air mail,1934
133776,04970742,n,10,"especially a long, formal letter",1934
133777,04970828,n,10,"a short personal letter: ""drop me a line when you get there""",1934
133778,04970961,n,10,a personal letter to a loved one expressing affection,1934
133779,04971086,n,10,a letter that can neither be delivered nor returned,1934
133780,04971195,n,10,any letter expressing an intention to take (or forgo) some action,1934
133781,04971341,n,10,"a rectangular piece of stiff paper used to send messages (may have printed greetings or pictures); ""they sent us a card from Miami""",
133782,04971613,n,10,a card expressing a birthday greeting,
133783,04971710,n,10,a card expressing get-well wishes,
133784,04971803,n,10,a card sent to express personal greetings,
133785,04971976,n,10,a card expressing a Christmas greeting,
133786,04972075,n,10,a card expressing an Easter greeting,
133787,04972169,n,10,a card sent or given (as to a sweetheart) on Saint Valentine's Day,
133788,04972291,n,10,a card expressing sympathy,
133789,04972377,n,10,a card for sending messages by post without an envelope,1934
133790,04972552,n,10,a postcard that folds so the message is inside,1934
133791,04972655,n,10,a postcard with a picture on one side,1934
133792,04972755,n,10,a card indicating that the sender will perform certain devotional acts on behalf of another (Roman Catholic Church),
133793,04972934,n,10,a statement acknowledging something or someone,
133794,04973257,n,10,an acknowledgment or expression of goodwill at parting,
133795,04973475,n,10,"a farewell remark: ""they said their good-byes""",
133796,04973723,n,10,an organized expression of goodwill at the start of a trip or new venture,
133797,04973864,n,10,(usually plural) an acknowledgment or expression of good will (especially on meeting),
133798,04974233,n,10,"an expression of good will from one person to another: ""much hand-shaking and well-wishing""",
133799,04974383,n,10,"(usually plural) a polite expression of desire for someone's welfare; ""give him my kind regards""; ""my best wishes""",
133800,04974571,n,10,"the manner in which something is greeted: ""she did not expect the cold reception she received from her superiors""",
133801,04974751,n,10,enthusiastic greeting,
133802,04974823,n,10,(Roman Catholic) a greeting signifying Christian love for those assisting at the Eucharist,1658
133803,04974979,n,10,"a greeting or reception: ""the proposal got a warm welcome""",
133804,04975139,n,10,kindness in welcoming guests or strangers,
133805,04975258,n,10,a warm welcome; may be insincere,
133806,04975346,n,10,an acknowledgment that can be used to say hello or goodbye (aloha is Hawaiian; ciao is Italian),
133807,04975500,n,10,grasping and shaking a person's hand (as to acknowledge an introduction or to agree on a contract),
133808,04975688,n,10,an act of greeting with friendly words and gestures like bowing or lifting the hat,
133809,04975823,n,10,"an expression of greeting: ""every morning they exchanged polite hellos""",
133810,04975983,n,10,a conventional expression of greeting or farewell,
133811,04976119,n,10,a conventional expression of greeting or farewell,
133812,04976259,n,10,a conventional expression of farewell,
133813,04976353,n,10,a formal military gesture of respect,
133814,04976462,n,10,a written greeting that is left to indicate that you have visited,
133815,04976609,n,10,"an expression of regret at having caused trouble for someone: ""he wrote a letter of apology to the hostess""",
133816,04976770,n,10,"an expression of sympathy with another's grief; ""they sent their condolences""",
133817,04976920,n,10,acknowledgement that someone has an occasion for celebration,
133818,04977056,n,10,the polite declining of an invitation,
133819,04977171,n,10,a message received and understood that reduces the recipient's uncertainty,
133820,04977724,n,10,information that is incorrect,
133821,04977814,n,10,"information (data or ideas or observations) that can be reworked into a finished form; ""the archives provided rich material for a definitive biography""",
133822,04978056,n,10,"old material that is slightly reworked and used again: ""merely a dull rehash of his first novel""",
133823,04978205,n,10,"true confidential information: ""after the trial he gave us the real details""",
133824,04978374,n,10,"slang terms for inside information: ""is that the straight dope?""",
133825,04978516,n,10,"a statement or assertion of verified information about something that is the case or has happened: ""he supported his argument with an impressive array of facts""",
133826,04978781,n,10,"a compilation of the known facts regarding something or someone: ""Al Smith used to say, ""Let's look at the record""""; ""his name is in all the recordbooks""",
133827,04979062,n,10,the organization of information according to preset specifications (usually for computer processing),1355
133828,04979296,n,10,(computer science) the format for the root directory and the file allocation tables and other basic configurations,1355
133829,04979478,n,10,(computer science) the format of sectors on the surface of a hard disk drive so that the operating system can access them,1355
133830,04979683,n,10,"(British) informal term for information; ""give me the gen on your new line of computers""",
133831,04979821,n,10,an organized body of related information,
133884,04988542,n,10,prescribed guide for conduct or action,
133832,04979970,n,10,"a database in which relations between information items are explicitly specified as accessible attributes: ""in a relational database the data are organized as a number of differently sized tables""",1355
133833,04980232,n,10,a database in which the operations carried out on information items (data objects) are considered part of their definition,1355
133834,04980444,n,10,a subset of data in a database that are used in a specific application,
133835,04980573,n,10,a database of information about words,1355
133836,04980709,n,10,a machine-readable version of a standard dictionary; organized alphabetically,1355
133837,04980890,n,10,a machine-readable lexical database organized by meanings,1355
133838,04981001,n,10,a statement of fundamental facts or principles,
133839,04981133,n,10,a number or ratio (a value on a scale of measurement) derived from a series of observed facts; can reveal relative changes as a function of time,1673
133840,04981457,n,10,"a statistical compilation that provides a context for economic or financial conditions: ""this business index is computed relative to the base year of 1995""","1673,1753"
133841,04981673,n,10,an indicator of stock market prices; based on the share values of 30 leading companies listed on the New York Stock Exchange,"1673,1753"
133842,04981884,n,10,one of 11 indicators for different sections of the economy; used by the Department of Commerce to predict economic trends in the near future,"1673,1753"
133843,04982088,n,10,an index that traces the relative changes in the price of an individual good (or a market basket of goods) over time,"1673,2872"
133844,04982330,n,10,an index of changes in retail prices,"1673,2872"
133845,04982431,n,10,an index of changes in wholesale prices,"1673,2872"
133846,04982561,n,10,an index of the cost of all goods and services to a typical consumer,"1673,2872"
133847,04982725,n,10,the aggregate of short sales on an open market,1673
133848,04982831,n,10,"new information about specific and timely events: ""they awaited news of the outcome""",
133849,04983034,n,10,"new information of any kind: ""it was news to me""",
133850,04983133,n,10,"secret information about an enemy (or potential enemy); ""we sent out planes to gather intelligence on their radar coverage""",1781
133851,04983315,n,10,good news,
133852,04983380,n,10,news that updates your information,
133853,04983467,n,10,"an indication that makes something evident: ""his trembling was evidence of his fear""",
133854,04983714,n,10,evidence that helps to solve a problem,
133855,04983888,n,10,a clue made by an impression of the ridges in the skin of a finger,
133856,04984030,n,10,the basic pattern of the human fingerprint,
133857,04984123,n,10,"a mark of a foot or shoe on a surface; a clue that someone was present: ""the police made casts of the footprints in the soft earth outside the window""",
133858,04984365,n,10,"a perceptible indication of something not immediately apparent (as a visible clue that something has happened); ""he showed signs of strain""; ""they welcomed the signs of spring""",
133859,04984599,n,10,"a clue that something has been present: ""there wasn't a trace of evidence for the claim""",
133860,04984758,n,10,"anything (such as a document or a phonograph record or a photograph) providing permanent evidence of or information about past events; ""the film provided a valuable record of stage techniques""",
133861,04985093,n,10,(logic or mathematics) a formal series of statements showing that if one thing is true something else necessarily follows from it,2873
133862,04985310,n,10,proof of a mathematical theorem,2873
133863,04985406,n,10,a logical proof of a proposition by showing that its negation leads to a contradiction,2873
133864,04985559,n,10,proof of a logical theorem,2873
133865,04985679,n,10,"something that serves as evidence: ""his effort was testimony to his devotion""",
133866,04985844,n,10,"strong evidence for something: ""his easy victory was a testament to his skill""",
133867,04985978,n,10,"a fact or assertion offered as evidence that something is true: ""it was a strong argument that his hypothesis was true""",
133868,04986290,n,10,an argument in favor of a proposal,
133869,04986392,n,10,an argument opposeed to a proposal,
133870,04986494,n,10,"a statement of facts and reasons used to support an argument: ""he stated his case clearly""",
133871,04986635,n,10,an argument that is conclusive,
133872,04986754,n,10,citing as evidence or proof,
133873,04986836,n,10,the evidence by which something is attested,
133874,04986937,n,10,information that confirms or verifies,
133875,04987069,n,10,"information that makes more forcible or convincing: ""his gestures provided eloquent reinforcement for his complaints""",
133876,04987262,n,10,confirmation that some fact or statement is true,
133877,04987402,n,10,direction or advice as to a decision or course of action,
133878,04987620,n,10,counseling on career opportunities,
133879,04987718,n,10,counseling on marital problems and disagreements,
133880,04987832,n,10,"an indication of potential opportunity: ""he got a tip on the stock market""; ""a good lead for a job""",
133881,04988037,n,10,important information about the plans or condition of a corporation that has not been released to the public; use for personal profit is illegal,
133882,04988247,n,10,guidance relative to setting standards or determining a course of action,
133883,04988375,n,10,"a systematic body of regulations defining the way of life of members of a religious order: ""the rule of St. Dominic""",
133886,04988933,n,10,a body of rules followed by an assembly,
133887,04989177,n,10,a procedure (in some parliaments) of demanding that a government official explain some act or policy,
133888,04989338,n,10,a rule of law whereby any alleged matter of fact that is submitted for investigation at a judicial trial is established or disproved,
133889,04989659,n,10,a rule of evidence requiring that to prove the content of a writing or recording or photograph the original is required,
133890,04989843,n,10,a rule of evidence whereby a person is barred from denying the truth of a fact that has already been settled,
133891,04990006,n,10,a rule that provides that otherwise admissible evidence cannot be used in a criminal trial if it was the result of illegal police conduct,
133892,04990207,n,10,a rule that once primary evidence is determined to have been illegally obtained any secondary evidence following from it may also not be used,
133893,04990422,n,10,a rule that declares not admissible as evidence any statement other than that by a witness,
133894,04990571,n,10,a rule that oral evidence cannot be used to contradict the terms of a written contract,
133895,04990723,n,10,a rule of evidence whereby the negligence of an alleged wrongdoer can be inferred from the fact that the accident happened,
133896,04990909,n,10,a rule of order permanently in force,
133897,04991006,n,10,rule of personal conduct,
133898,04991169,n,10,the principle that conduct should be moral,
133899,04991291,n,10,"any important rule: ""the golden rule of teaching is to be clear""",
133900,04991413,n,10,the moral principle that behavior should be determined by duty,
133901,04991544,n,10,a principle stating the action required to attain a desired goal,
133902,04991678,n,10,"a line of argument rationalizing the course of action of a government: ""they debated the policy or impolicy of the proposed legislation""",1718
133903,04991993,n,10,a government policy for maintaining economic growth and tax revenues,"1718,1753"
133904,04992195,n,10,a government policy for dealing with the budget (especially with taxation and borrowing),"1718,1753"
133905,04992343,n,10,the economic policy of F. D. Roosevelt,"1718,1753"
133906,04992436,n,10,"the economic policy of controlling or limiting or curbing prices or wages etc: ""they wanted to repeal all the legislation that imposed economic controls""","1718,1753"
133907,04992698,n,10,restriction on maximum prices that is established and maintained by the government (as during periods of war or inflation),"1718,1753"
133908,04992880,n,10,"an upper limit on what is allowed: ""they established a cap for prices""","1718,1753"
133909,04993010,n,10,"a lower limit: ""the government established a wage floor""","1718,1753"
133910,04993125,n,10,the policy of imposing duties or quotas on imports in order to protect home industries from overseas competition,"1718,1753"
133911,04993315,n,10,a policy of for dealing with social issues,1718
133912,04993435,n,10,a policy of socioeconomic reform,1718
133913,04993545,n,10,"a policy designed to redress past discrimination against women and minority groups through measures to improve their economic and educational opportunities: ""affirmative action has been extremely controversial and was challenged in 1978 in the Bakke decision""",1718
133914,04993869,n,10,any regulation or policy that restricts international trade,"1718,1753"
133915,04994041,n,10,"a limitation on imports: ""the quota for Japanese imports was negotiated""","1718,1753"
133916,04994165,n,10,a government order imposing a trade barrier,"1718,1753"
133917,04994295,n,10,the policy of perpetuating native cultures (in opposition to acculturation),1718
133918,04994425,n,10,"the policy of a political group: ""He won in a vote along party lines""",1718
133919,04994551,n,10,a policy governing international relations,1718
133920,04994834,n,10,the policy of pushing a dangerous situation to the brink of disaster (to the limits of safety),1718
133921,04994987,n,10,a policy of extending your rule over foreign countries,1718
133922,04995117,n,10,a policy of intervening in the affairs of other countries,1718
133923,04995284,n,10,"a foreign policy of staying out of other countries"" disputes",1718
133924,04995460,n,10,"a policy of not initiating hostilities: ""they signed a nonagression pact""",1718
133925,04995593,n,10,a policy of imperialism rationalized as inevitable (as if granted by God),1718
133926,04995729,n,10,a policy of nonparticipation in international economic and political relations,1718
133927,04995866,n,10,an American foreign policy opposing interference in the Western hemisphere from outside powers,1718
133928,04996022,n,10,President Truman's policy of providing economic and military aid to any country threatened by communism or totalitarian ideology,1718
133929,04996212,n,10,a policy of neutrality or nonalignment in international affairs,1718
133930,04996332,n,10,a government's policy controlling foreign trade,"1718,2872"
133931,04996482,n,10,the policy of granting equal trade opportunities to all countries,"1718,2872"
133932,04996622,n,10,a policy for establishing and developing a national homeland for Jews in Palestine,1718
133933,04996758,n,10,a system of principles governing morality and acceptable conduct,
133934,04996926,n,10,a commercial principle that without a warranty the buyer takes upon himself the risk of quality,
133935,04997081,n,10,an authoritative rule,
133936,04997156,n,10,an authoritative rule or law,
133937,04997289,n,10,regulation establishing the top speed permitted on a given road,1946
133938,04997410,n,10,the regulation of weights and measures of articles offered for sale,
133939,04997530,n,10,"a rule or especially body of rules or principles generally established as valid and fundamental in a field or art or philosophy: ""the neoclassical canon""; ""canons of polite society""",
133940,04997763,n,10,rules governing socially acceptable behavior,
133941,04997899,n,10,forms of ceremony and etiquette observed by diplomats and heads of state,
133942,04998026,n,10,(computer science) rules determining the format and transmission of data,1355
133943,04998269,n,10,(computer science) protocol that allows users to copy files between their local system and any system they can reach on the network,1355
133944,04998493,n,10,"a common way to make software available; users are allowed to log in as ""guest"" without a password and copy whatever has been made available",1355
133945,04998728,n,10,a protocol (utilizing TCP) to transfer hypertext requests and information between servers and browsers,1355
133946,04998911,n,10,a standard protocol for communication between electronic musical instruments and computers,1355
133947,04999091,n,10,"a protocol developed for the internet to get data from one network device to another: ""TCP uses a retransmission strategy to insure that data will not be lost in transmission""",1355
133948,04999367,n,10,a set of protocols (including TCP) developed for the internet in the 1970s to get data from one network device to another,1355
133949,04999610,n,10,a fine point of etiquette or petty formality,
133950,04999710,n,10,a rule for ending debate in a deliberative body,
133951,04999850,n,10,closure imposed on the debate of specific sections of a bill,
133952,04999993,n,10,a question as to whether the current proceedings are allowed by parliamentary procedure,
133953,05000141,n,10,a set of rules or principles or laws especially written ones,
133954,05000339,n,10,"a code of laws adopted by a state or nation: ""a code of laws""",1802
133955,05000529,n,10,the legal code governing crimes and their punishment,1802
133956,05000638,n,10,set of standards established and enforced by local government for the structural safety of buildings,
133957,05000798,n,10,set of standards established and enforced by government for health requirements as in plumbing etc,2232
133958,05000970,n,10,set of standards established and enforced by government for fire prevention and safety in case of fire as in fire escapes etc,
133959,05001151,n,10,an ethical or moral code that applies more strictly to one group than to another,
133960,05001311,n,10,a code that permits greater sexual freedom for men than for women (associated with the subordination of women),
