 endorsed policy in the platform of a political party,1718
133207,04879740,n,10,"official papers which a ship is legally required to have; related to ownership, cargo, etc.",1802
133208,04879891,n,10,a customs document listing the contents put on a ship or plane,1802
133209,04880008,n,10,a last-in first-out kind of queue (LIFO),1355
133210,04880110,n,10,a public register showing the details of ownership and value of land; made for the purpose of taxation,2415
133211,04880278,n,10,a written document preserving knowledge of facts or events,
133212,04880739,n,10,a book in which detailed written records of a case are kept and which are a source of information for subsequent work,
133213,04880911,n,10,a written record of events on a voyage (of a ship or plane),
133214,04881020,n,10,a book in which the log is written,
133215,04881126,n,10,a written record of the transmissions by a radio station,
133216,04881232,n,10,a logbook in which all orders concerning the main engines of a ship are recorded,
133217,04881368,n,10,a card recording an employee's starting and quitting times each work day,
133218,04881495,n,10,a record of the hours worked by employees,
133219,04881593,n,10,record of a British land survey ordered by William the Conqueror,
133220,04881717,n,10,an item inserted in a written record,
133221,04881841,n,10,an entry in the court record to the effect that the plaintiff or prosecutor will not proceed,
133222,04882005,n,10,a reproduction of a written record (e.g. of a legal or school record),
133223,04882138,n,10,the daily written record of events (as arrests) in a police station,
133224,04882302,n,10,a record of things worth remembering,
133225,04882396,n,10,"a brief written record: ""he made a note of the appointment""",
133226,04882560,n,10,a brief (and hurriedly handwritten) note,
133227,04882660,n,10,a written proposal or reminder,
133228,04882784,n,10,"a short note: ""the secretary keeps the minutes of the meeting""",
133229,04882899,n,10,a memorandum summarizing the items of an agreement,
133230,04883008,n,10,"(slang) a remarkable or astounding message; ""that story was a corker""",
133231,04883131,n,10,"a message that helps you remember something: ""he ignored his wife's reminders""",
133232,04883282,n,10,an official written record of names or events or transactions,
133288,04892101,n,10,statement of charges for staying in a hotel,1753
133233,04883463,n,10,official record of the pedigree of purebred animals especially horses,
133234,04883587,n,10,a register of rents; includes the names of tenants and the amount of rent they pay,
133235,04883725,n,10,(sports) a record of win versus losses,2638
133236,04883825,n,10,a register of persons who are socially prominent,1422
133237,04883929,n,10,the part of a check that is retained as a record,1766
133238,04884055,n,10,"a record of scores (as in golf); ""you have to turn in your card to get a handicap""",
133239,04884200,n,10,a written account of what transpired at a meeting,
133240,04884387,n,10,a book in which minutes have been written,
133241,04884505,n,10,a published account of the speeches and debates and votes of the U.S. Congress,
133242,04884650,n,10,"the official published verbatim report of the proceedings of a parliamentary body; originally of the British Parliament: ""the Canadian Hansard is published in both English and French""",
133243,04884887,n,10,a collection of papers containing detailed information about a particular person or subject (usually a person's record),
133244,04885060,n,10,a set of related records (either written or electronic) kept together,
133245,04885246,n,10,(computer science) a file maintained in computer-readable form,1355
133246,04885530,n,10,(computer science) a computer file dedicated to storing and updating computer backups,1355
133247,04885673,n,10,(computer science) a computer file containing machine-readable information that must be read by an application; characters use all 8 bits of each byte,1355
133248,04885881,n,10,(computer science) a computer file that is used as the authority in a given job and that is relatively permanent,1355
133249,04886063,n,10,(computer science) a computer file stored on a magnetic disk and identified by a unique label,1355
133250,04886212,n,10,(computer science) a computer file containing relatively transient data about a particular data processing task,1355
133251,04886400,n,10,(computer science) a computer file that contains data that serve as input to a device or program,1355
133252,04886566,n,10,(computer science) a computer file that contains data that are the output of a device or program,1355
133253,04886720,n,10,(computer science) a file that you can read but cannot change,1355
133254,04886842,n,10,(computer science) a computer file that contains text (and possibly formatting instructions) using 7-bit ASCII characters,1355
133255,04887048,n,10,a text file that contains only ASCII characters without special formatting,1355
133256,04887202,n,10,a file of mug shots (pictures of criminals that are kept on file by the police),
133257,04887366,n,10,"a formal document giving notice of your intention to resign: ""he submitted his resignation as of next month""",
133258,04887532,n,10,a formal expression by a meeting; agreed to by a vote,1820
133259,04887702,n,10,the document recording the proclamation of the 2nd American Continental Congress (4 july 1776) asserting the independence of the colonies from Great Britain,1820
133260,04887932,n,10,(U.S.) a resolution passed by both houses of Congress which becomes legally binding when signed by the chief executive (or passed over the executive's veto),1820
133261,04888151,n,10,"a verbal or written request for assistance or employment or admission to a school: ""December 31 is the deadline for applications""",
133262,04888410,n,10,an application for a job,
133263,04888496,n,10,an application for a line of credit,
133264,04888596,n,10,an application to borrow money,
133265,04888707,n,10,an application for a mortgage loan,
133266,04888808,n,10,an application for sole rights to an invention,
133267,04888919,n,10,a formal message requesting something submitted to an authority,
133268,04889101,n,10,a written statement of facts submitted in conjunction with a petition to a an authority,
133269,04889243,n,10,request for a sum of money (as in church),
133270,04889397,n,10,(British) solicitation of money usually for a benevolent purpose,
133271,04889518,n,10,"a record or narrative description of past events: ""a history of France""; ""he gave an inaccurate account of the plot to kill the president""; ""the story of exposure to lead""",
133272,04889863,n,10,a record of events in the order of their occurrence,
133273,04889971,n,10,a history of a word,1969
133274,04890064,n,10,a popular but erroneous etymology,1969
133275,04890158,n,10,detailed record of the background of a person or group under study or treatment,
133276,04890314,n,10,the case history of a medical patient,2232
133277,04890442,n,10,writing having historical value (as opposed to fiction or myth etc.),
133278,04890615,n,10,a chronological account of events in successive years,
133279,04890744,n,10,an account of the series of events making up a person's life,
133280,04890949,n,10,a biography of yourself,
133281,04891050,n,10,a biography that idealizes or idolizes the person,
133282,04891157,n,10,biographical sketch,
133283,04891230,n,10,an account of the author's personal experiences,
133284,04891330,n,10,a document showing credits and debits,"1753,2872"
133285,04891517,n,10,"a periodic statement prepared by a bank for each client: ""I wish my bank statement arrived earlier in the month""","1753,2872"
133286,04891690,n,10,"a statement of money owed for goods or services: ""he paid his bill and left""; ""send me an account of what I owe""",1753
133289,04892201,n,10,statement of charges for medical services,"1753,2232"
133290,04892317,n,10,statement of charges for telephone service,1753
133291,04892433,n,10,a bill for an amount due,1753
133292,04892521,n,10,money owed for taxes,1784
133293,04892596,n,10,"the bill in a restaurant: ""he asked the waiter for the check""",1753
133294,04892722,n,10,a negotiable certificate that can be detached and redeemed as needed,2872
133295,04892853,n,10,a commercial document showing that the holder is entitled to ride on public transportation or enter a public entertainment,2872
133296,04893172,n,10,a ticket good for several trips or to attend a season of entertainments; sold at a reduced rate,2872
133297,04893348,n,10,a ticket good for a trip on an airplane,1946
133298,04893464,n,10,"a complementary (free) ticket; ""the start got passes for his family""",
133299,04893583,n,10,a ticket that allows a passenger to change conveyances,1946
133300,04893692,n,10,a ticket good for a ride on a railroad train,1946
133301,04893813,n,10,a ticket good for admission to a theater,2610
133302,04893931,n,10,a ticket good for a ride on a bus,1946
133303,04894021,n,10,a ticket to a place and back (usually over the same route),1946
133304,04894177,n,10,a return ticket (at reduced fare) for traveling both ways in the same day,1946
133305,04894307,n,10,an acknowledgment (usually tangible) that payment has been made,1753
133306,04894478,n,10,a torn part of a ticket returned to the holder as a receipt,1753
133307,04894620,n,10,a ticket stub entitling the holder to admission to a future event if the scheduled event was cancelled due to rain,1753
133308,04894791,n,10,a receipt from the carrier for the goods being shipped,"1753,1946,2872"
133309,04894916,n,10,a binding agreement between two or more persons especially one enforceable by law,"1753,1802"
133310,04895594,n,10,a contract that heavily restricts one party while leaving the other free (as some standard form printed contracts); implies inequality in bargaining power,"1753,1802"
133311,04895835,n,10,a contract whose performance by one party depends on the occurrence of an uncertain contingent event (but if it is contingent on the outcome of a wager it is not enforceable),"1753,1802"
133312,04896073,n,10,a contract involving mutual promises (each part is both promisor and promisee),"1753,1802"
133313,04896216,n,10,a contract to hire or lease transportation,"1753,1802"
133314,04896312,n,10,a contract whose performance depends on a fact or event that affects legal relations,"1753,1802"
133315,04896463,n,10,a contract in which the contractor is paid his total cost plus a stated percentage of profit,"1753,1802"
133316,04896620,n,10,a contract whose performance by one party is contingent on the outcome of a bet; unenforceable by statute in most jurisdictions,"1753,1802"
133317,04896811,n,10,a contract granting use or occupation of property during a specified time for a specified payment,"1753,1802"
133318,04896960,n,10,a prenuptial agreement or contract,"1753,1802"
133319,04897080,n,10,a contract in which you promise to deliver your entire output to the other party who promises to accept it,"1753,1802"
133320,04897248,n,10,"written contract or certificate of insurance: ""you should have read the small print on your policy""","1802,1896"
133321,04897449,n,10,a contract stating the terms of a purchase,"1769,1802,2872"
133322,04897576,n,10,a contract created by law for reasons of justice without any expression of assent,"1753,1802"
133323,04897718,n,10,a contract in which you agree to purchase all your requirements of a particular sort from one party,"1753,1802"
133324,04897885,n,10,a contract that is signed and has the (wax) seal of the signer attached,"1753,1802"
133325,04898061,n,10,a contract for maintenance services,"1753,1802"
133326,04898159,n,10,a contract in which in the event of a breach by one of the parties can be considered as several independent agreements expressed in a single instrument,"1753,1802"
133327,04898375,n,10,a contract assigning to another party some obligations of a prior contract,"1753,1802"
133328,04898507,n,10,a secret agreement between two or more people to perform an unlawful act,
133329,04898668,n,10,"a conspiracy not to talk about some situation or event: ""there was a conspiracy of silence about police brutality""",
133330,04898850,n,10,(Bible) an agreement between God and his people in which God makes certain promises and requires certain behavior from them in return,1565
133331,04899038,n,10,a one-sided agreement whereby you promise to do (or refrain from doing) something in return for a performance (not a promise),
133332,04899229,n,10,a certificate or voucher acknowledging a debt,1802
133333,04899330,n,10,an insurance policy covering loss of movable property (e.g. jewelry) regardless of its location,"1802,1896"
133334,04899497,n,10,a contract between two or more persons who agree to pool talent and money and share profits or losses,"1753,1802"
133335,04899656,n,10,a contract between crew and captain of a ship,"1753,1802"
133336,04899789,n,10,"a contract granting the right to operate a subsidiary business: ""he got the beer concession at the ball park""","1753,1802"
133337,04899981,n,10,an authorization to sell a company's goods or services in a particular place,"1753,1802"
133338,04900113,n,10,contract between labor and management government wages and benefits and working conditions,"1753,1802"
133339,04900323,n,10,a now-illegal labor contract whereby the employee agrees not to join a trade union,"1753,1802"
133340,04900471,n,10,contract between employer and employee,"1753,1802"
133341,04900598,n,10,a contract governing the marketing of an item of merchandise,"1753,1802"
157642,08979331,n,10,Eurasian shrub,"2158,2172"
133342,04900727,n,10,contract giving someone the legal right to use a patent or trademark,"1753,1802"
133343,04900861,n,10,contract governing the merger of two or more companies,"1753,1802"
133344,04901002,n,10,"an agreement (or contract) in which property is transferred from the seller (vendor) to the buyer (vendee) for a fixed price in money (paid or agreed to be paid by the buyer); ""the salesman faxed the sales agreement to his home office""",2872
133345,04901342,n,10,a sale in which the buyer receives title to the property only upon the performance of some condition (usually the full payment of the purchase price),2872
133346,04901554,n,10,a sale of a tract of land as a whole without a warranty as to the acreage,"1753,1802"
133347,04901708,n,10,a sale of property by the sheriff under authority of a court's judgment in order satisfy and unpaid obligation,2872
133348,04901909,n,10,a document appraising the value of something (as for insurance or taxation),1753
133349,04902082,n,10,an appraisal that is too high,1753
133350,04902219,n,10,"a commercial document used to request someone to supply something in return for payment: ""IBM received an order for a hundred computers""",2872
133351,04902532,n,10,an order that is received without payment; requires billing at a later date,2872
133352,04902700,n,10,an unpaid credit order,2872
133353,04902781,n,10,(British) an order for goods to be exported or imported,2872
133354,04902889,n,10,an order to a broker to sell or buy stocks or commodities at the prevailing market price,"1769,2872"
133355,04903036,n,10,an order to a broker to sell (buy) when the price of a security falls (rises) to a designated level,"1769,2872"
133356,04903210,n,10,a depositor's order to a bank to refuse payment on a check,2872
133357,04903327,n,10,a purchase negotiated by mail,2872
133358,04903413,n,10,a legal instrument authorizing someone to act as the grantor's agent,1802
133359,04903581,n,10,a power of attorney document to transfer ownership of a registered security from the owner to another party,"1769,1802"
133360,04903746,n,10,a power of attorney document given by shareholders of a corporation authorizing a specific vote on their behalf at a corporate meeting,1802
133361,04903932,n,10,the letters used to identify listed companies on the securities exchanges where they are traded,1769
133362,04904086,n,10,legal document naming someone to administer an estate when no executor has been named,1802
133363,04904243,n,10,a legal document giving information required for employment,1802
133364,04904391,n,10,a legal document codifying the result of deliberations of a committee or society or legislative body,1802
133365,04904589,n,10,"one of a set of rules governing a particular activity or a legal document setting forth such a rule: ""there is a law against kidnapping""",1802
133366,04904974,n,10,a statute prescribing the time period during which legal action can be taken,1802
133367,04905119,n,10,law determining the fundamental political principles of a government,1802
133368,04905296,n,10,the constitution written at the Constitutional Convention in Philadelphia in 1787 and subsequently ratified by the original thirteen states,1802
133369,04905639,n,10,a law affecting the public at large,1802
133370,04905731,n,10,the legal code of ancient Rome; codified under Justinian; the basis for many modern systems of civil law,1802
133371,04905933,n,10,the code of laws of the Salian Franks and other German tribes,1802
133372,04906050,n,10,(civil law) a law established by following earlier judicial decisions,1802
133373,04906199,n,10,a law enacted by a legislative body,1802
133374,04906379,n,10,legislation intended to promote free competition in the market place by outlawing monopolies,1802
133375,04906555,n,10,legislation that gives appropriate officials the authority to implement or enforce the law,1802
133376,04906712,n,10,a law passed by US Congress to prevent employees from being injured or contracting diseases in the course of their employment,1802
133377,04906950,n,10,a legal phrase in the US Constitution that allows the Senate to constrain the President's powers of appointment and treaty-making,"1802,1969"
133378,04907163,n,10,a record of the whole body of legislation in a given jurisdiction,
133379,04907306,n,10,"a statute in draft before it becomes law: ""they held a public hearing on the bill""",1802
133380,04907558,n,10,a legislative act proposing to authorize the expenditure of public funds for a specified purpose,1802
133381,04907738,n,10,a legislative act finding a person guilty of treason or felony without a trial,1802
133382,04907880,n,10,a statute that would require merchants to reclaim used bottles,1802
133383,04908000,n,10,a statute that would regulate farm production and prices,1802
133384,04908112,n,10,a statute that would regulate foreign trade,"1802,2872"
133385,04908212,n,10,a rule made by a local authority to regulate its own affairs,
133386,04908334,n,10,a statute regulating work on Sundays,1802
133387,04908425,n,10,a state law regulating the sale of securities in an attempt to control the sale of securities in fraudulent enterprises,1802
133388,04908603,n,10,a law conferring privileges on owners of homesteads,1802
133389,04908714,n,10,a law providing support for the poor,1802
133390,04908805,n,10,a former English law requiring mobs to disperse after a magistrate reads the law to them,1802
133391,04908967,n,10,"a vigorous reprimand: ""I read him the riot act""",
133392,04909069,n,10,the body of law dealing with crimes and their punishment,1802
133393,04909203,n,10,a writ issued by a court of law requiring a person to do something or to refrain from doing something,1802
133394,04909380,n,10,"a legally binding command or decision entered on the court record (as if issued by a court or judge); ""a friend in New Mexico said that the order caused no trouble out there""",1802
133395,04909767,n,10,an order that after a specific time certain activities (as being outside on the streets) are prohibited,1802
133396,04909923,n,10,a decree issued on a first petition for divorce; becomes absolute at some later date,1802
133397,04910065,n,10,"an order to an offending party to rid itself of property; it has the purpose of depriving the defendant of the gains of wrongful behavior: ""the court found divestiture to be necessary in preventing a monopoly""",1802
133398,04910332,n,10,a decree issued by a sovereign ruler,1802
133399,04910466,n,10,an edict of the Russian tsar,1802
133400,04910546,n,10,a judicial decree regulating the rights and responsibilities of a married couple living apart,1802
133401,04910724,n,10,an imperial decree that becomes part of the fundamental law of the land,1802
133402,04910860,n,10,an edict that has been publicly posted,1802
133403,04910954,n,10,"a law forbidding the sale of alcoholic beverages: ""in 1920 the 18th amendment to the Constitution established prohibition in the US""",1802
133404,04911144,n,10,a decree that prohibits something,1802
133405,04911307,n,10,"a judicial order forbidding some action until an event occurs or the order is lifted: ""the Supreme Court has the power to stay and injunction pending an appeal to the whole Court""",1802
133406,04911555,n,10,an order whereby a judgment is precluded from being executed for a specific period of time,1802
133407,04911709,n,10,an order that bans something,1802
133408,04911797,n,10,(law) a judicial remedy issued in order to prohibit a party from doing or continuing to do a certain activity,1802
133409,04911988,n,10,a document stating the facts and points of law of a client's case,1802
133410,04912137,n,10,a brief presented by someone interested in influencing the outcome of a lawsuit but who is not a party to it,1802
133411,04912311,n,10,a legal document declaring a person's wishes regarding the disposal of their property when they die,1802
133412,04912546,n,10,a judicial certificate saying that a will is genuine and conferring on the executors the power to administer the estate,
133413,04912734,n,10,a supplement to a will; a testamentary instrument intended to alter an already executed will,"1422,1802"
133414,04912899,n,10,"a document written by someone still legally capable requesting that they should be allowed to die if subsequently severely disabled or suffering terminal illness: ""after he discovered he had AIDS he drew up a living will""",1802
133415,04913178,n,10,"a legal document signed and sealed and delivered to effect a transfer of property and to show the legal right to possess it: ""he signed the deed""; ""he kept the title to his car in the glove compartment""",1802
133416,04913532,n,10,the instrument by which a claim or right or interest or property is transferred from one person to another,"1753,1802"
133417,04913695,n,10,a deed transferring personal property,1802
133418,04913791,n,10,a deed made and executed by only one party,1802
133419,04913889,n,10,deed embodying a mortgage,1802
133420,04913974,n,10,a legal document proving a person's right to property,1802
133421,04914102,n,10,a written instrument legally conveying property to a trustee often used to secure an obligation such as a mortgage or promissory note,1802
133422,04914308,n,10,document effecting a property transfer,"1753,1802"
133423,04914421,n,10,document transferring title or right or claim to another,"1753,1802"
133424,04914550,n,10,deeds and other documentary evidence of title to land,1802
133425,04914659,n,10,an authorization allowing police to perform specified acts,1802
133426,04914897,n,10,a warrant to search,1802
133427,04914977,n,10,a warrant to apprehend an offender,1802
133428,04915106,n,10,"(informal) a warrant to take someone into custody; ""put out a pickup on that man""",1802
133429,04915240,n,10,a warrant to execute the death sentence,1802
133430,04915339,n,10,French history: the king could warrant imprisonment or death in a signed letter under his seal,1802
133431,04915505,n,10,a warrant granting postponement (usually to postpone the execution of the death sentence),1802
133432,04915649,n,10,a warrant substituting a lesser punishment for a greater one,1802
133433,04915767,n,10,"document giving the tax collector information about the taxpayer's tax liability; ""his gross income was enough that he had to file a tax return""","1784,1802"
133434,04916087,n,10,a tax return that corrects the information in an earlier return,"1784,1802"
133435,04916211,n,10,return required of a taxpayer whose tax withheld from income does not meet the tax liability for the year,"1784,1802"
133436,04916415,n,10,an incorrect income tax return,"1784,1802"
133437,04916504,n,10,a return that provides information to the tax collector but does not compute the tax liability,"1784,1802"
133438,04916663,n,10,a return filed by a husband and wife,"1784,1802"
133439,04916758,n,10,a legal document giving official permission to do something,1802
133440,04917060,n,10,a document authorizing the holder to construct a building of a particular kind on a particular lot,1802
133441,04917220,n,10,a license authorizing the bearer to drive a motor vehicle,1802
133442,04917340,n,10,a license authorizing the bearer to fish during a specified period of time,"1802,2655"
133443,04917476,n,10,a license authorizing the bearer to kill a certain type of animal during a specified period of time,"1802,2656"
133444,04917652,n,10,a document authorizing the bearer to learn to drive an automobile,1802
133445,04917780,n,10,a license to a private citizen to seize property of another nation,1802
133446,04917959,n,10,a license authorizing the holder to sell alcoholic beverages,1802
133447,04918098,n,10,a license to sell liquor for consumption on the premises,1802
133448,04918211,n,10,a license authorizing a man and a woman to marry,1802
133449,04918340,n,10,a license to pursue a particular occupation,1802
133450,04918448,n,10,an official document granting a right or privilege,1802
133451,04918568,n,10,"the legal document stating the reasons for a judicial decision: ""opinions are usually written by a single judge""",1802
