136397,05369065,n,10,an argument that ignores all unfavorable evidence,
136398,05369177,n,10,"a dispute where there is strong disagreement: ""they were involved in a violent argument""",
136399,05369415,n,10,a controversy (especially over a belief or dogma),
136400,05369518,n,10,"an angry dispute: ""they had a quarrel""; ""they had words""",
136401,05369724,n,10,"an intense verbal dispute: ""a violent fight over the bill is expected in the Senate""",
136402,05369860,n,10,noisy quarrel,
136403,05369967,n,10,a silly altercation,
136404,05370050,n,10,petty quarrel,
136405,05370160,n,10,a serious quarrel (especially one that ends a friendship),
136406,05370271,n,10,"the verbal act of offering: ""a generous offer of assitance""",
136408,05370646,n,10,"a request for payment: ""the notification stated the grace period and the penalties for defaulting""",
136409,05370812,n,10,"an expression of some desire or inclination: ""I could tell that it was his wish that the guests leave""; ""his crying was an indirect request for attention""",
136410,05371036,n,10,a formal request to participate or be present,
136411,05371174,n,10,"a request to be present: ""they came at his bidding""",
136412,05371289,n,10,"a colloquial expression for invitation: ""he didn't get no invite to the party""",
136413,05371420,n,10,earnest or urgent request,
136414,05371608,n,10,impassioned appeals to the prejudices and emotions of the populace,
136415,05371761,n,10,an appeal intended to arouse patriotic emotions,
136416,05371877,n,10,humble request for help,
136417,05371966,n,10,"an entreaty addressed to someone of superior status: ""a solicitation to the king for relief""",
136418,05372171,n,10,a solicitation for money or food (especially in the street by an apparently penniless person),
136419,05372341,n,10,"the act of soliciting money (as a gift or loan); ""he watched the beggar trying to make a touch""",
136420,05372488,n,10,insistent begging,
136421,05372563,n,10,a petition or appeal made to a person of superior status or rank,
136422,05372686,n,10,"a man's courting of a woman; seeking the affections of a woman (usually with the hope of marriage); ""its was a brief and intense courtship""",
136423,05372926,n,10,a one-time custom during courtship of unmarried couples occupying the same bed without undressing,
136424,05373078,n,10,reverent petition to a deity,1565
136425,05373317,n,10,a ceremonial prayer invoking divine protection,1565
136426,05373450,n,10,a spoken blessing,1565
136427,05373521,n,10,a short prayer generally preceding the lesson in the Church of Rome or the Church of England,1565
136428,05373667,n,10,prayers proclaiming God's anger against sinners; read in the Church of England on Ash Wednesday,1565
136429,05373820,n,10,a short prayer of thanks before a meal,1565
136430,05373954,n,10,a prayer to God on behalf of another person,1565
136431,05374056,n,10,a prayer asking God's help as part of a religious service,1565
136432,05374222,n,10,a solemn supplication ceremony prescribed by the church,1565
136433,05374332,n,10,a prayer for the repose of the soul of a dead person,1565
136434,05374441,n,10,"a request: ""many calls for Christmas stories""; ""not many calls for buggywhips""",
136435,05374570,n,10,"request for payment of a debt: ""they submitted their charges at the end of each month""",1753
136436,05374737,n,10,a document that must be accepted and paid by another person,1753
136437,05374854,n,10,"an urgent or peremptory request: ""his demands for attention were unceasing""",
136438,05375126,n,10,a demand by a sentry for a password or identification,
136439,05375235,n,10,a final peremptory demand,
136440,05375316,n,10,continual and persistent demands,
136441,05375417,n,10,"a demand especially in the phrase ""the call of duty""",
136442,05375528,n,10,an authoritative request,
136443,05375610,n,10,"a demand for a show of hands in a card game: ""after two raises there was a call""",2637
136444,05375760,n,10,a demand by a broker that a customer deposit enough to bring his margin up to the minimum requirement,1753
136445,05375926,n,10,the wage demanded from management for workers by their union representatives,
136446,05376071,n,10,a request by children on Halloween; they pass from door to door asking for goodies and threatening to play tricks on those who refuse,
136447,05376265,n,10,a request for information,
136448,05376414,n,10,"questioning a statement and demanding an explanation: ""he challenged the assumption that Japan is our enemy""",
136449,05376578,n,10,"an instance of questioning: ""there was a question about my training""; ""we made inquiries of all those who were present""",
136450,05376816,n,10,a question that can be answered by yes or no,1969
136451,05376922,n,10,formal systematic questioning,
136452,05377133,n,10,a series of question put to an individual (such as a political candidate) to elicit their views,
136453,05377284,n,10,a severe interrogation,1802
136454,05377364,n,10,interrogation accompanied by torture to extort information or a confession,1802
136455,05377497,n,10,close questioning,
136456,05377597,n,10,a question asked in cross-examination,
136457,05377714,n,10,"the questioning of a person (or a conversation in which information is elicited); often conducted by journalists; ""my interviews with teen-agers revealed a weakening of religious bonds""",
136458,05377973,n,10,an interview conducted over the telephone,1939
136459,05378080,n,10,"a sentence of inquiry that asks for a reply: ""he asked a direct question""; ""he had trouble phrasing his interrogations""",1969
136460,05378329,n,10,"a set of questions or exercises evaluating skill or knowledge: ""when the test was stolen the professor had to make a new set of questions""",1919
136461,05378665,n,10,an examination administered at the end of an academic term,1919
136462,05378809,n,10,an examination administered in the middle of an academic term,1919
136463,05378961,n,10,a quiz given without prior warning,1919
136464,05379050,n,10,an examination conducted by word of mouth,1919
136465,05379185,n,10,an examination taken by graduate students to determine their fitness to continue,1919
136466,05379363,n,10,an examination consisting of a few short questions,1919
136467,05379482,n,10,a written examination,1919
136468,05379577,n,10,final honors degree examinations at Cambridge University,1919
136469,05379686,n,10,"the speech act of continuing a conversational exchange: ""he growled his reply""",
136470,05379917,n,10,a reply that has no relevance to what preceded it,
136471,05380025,n,10,"a reply to a question or remark (especially a witty or critical one); ""it brought a sharp rejoinder from the teacher""",
136472,05380255,n,10,a reply that repeats what has just been said,
136473,05380350,n,10,the speech act of replying to a question,
136474,05380497,n,10,lots thrown to determine God's answers to yes-no questions,1565
136475,05380618,n,10,"the speech act of answering an attack on your assertions: ""his refutation of the charges was short and persuasive""; ""in defense he said the other man started it""",
136476,05380874,n,10,the act of refuting by offering a contrary contention or argument,
136477,05380994,n,10,a act of describing something,
136478,05381135,n,10,"a graphic or vivid verbal description: ""too often the narrative was interrupted by long word pictures""; ""the author gives a depressing picture of life in Poland""",
136479,05381462,n,10,descriptive word or phrase,
136480,05381542,n,10,a word picture of a person's appearance and character,
136481,05381676,n,10,"a brief description given for purposes of identification: ""the label Modern is applied to many different kinds of architecture""",
136482,05381855,n,10,an individualized description of a particular instance,
136483,05381985,n,10,brief description,
136484,05382066,n,10,the act of affirming or asserting or stating something,
136485,05382220,n,10,one chap's arbitrary assertion,
136486,05382303,n,10,"a reply of affirmation: ""he answered in the affirmative""",
136487,05382489,n,10,"an affirmative: ""I was hoping for a yes""",
136488,05382597,n,10,"an affirmative: ""The yeas have it""",
136489,05382699,n,10,an assertion that something alleged is not true,
136490,05382817,n,10,"the act of refusing a request: ""it resulted in a complete denial of his privileges""",
136491,05383025,n,10,the act of saying no to a request,
136492,05383114,n,10,"a reply of denial: ""he answered in the negative""",
136493,05383289,n,10,"a negative: ""his no was loud and clear""",
136494,05383395,n,10,"a negative: ""the nays have it""",
136495,05383493,n,10,"a grammatically substandard but emphatic negative: ""I don't never go""",
136496,05383624,n,10,"an affirmative constructed from two negatives: ""A not unwelcome outcome""",
136497,05383758,n,10,the act of refusing,
136498,05383849,n,10,denial of any connection with or knowledge of,
136499,05383968,n,10,a disavowal of a previous assertion,
136500,05384105,n,10,a retraction of a previously held position,
136501,05384228,n,10,the act of negating,
136502,05384349,n,10,"the speech act of contradicting someone: ""he spoke as if he thought his claims were immune to contradiction""",
136503,05384517,n,10,"(in logic) a statement that is necessarily false; ""the statement ""he is brave and he is not brave"" is a contradiction""","1451,2873"
136504,05384738,n,10,the act of revoking or annulling or making void,
136505,05384844,n,10,the speech act of rejecting,
136506,05384981,n,10,rejecting as invalid,
136507,05385110,n,10,(law) a voluntary repudiation of a person's legal claim to something,1802
136508,05385235,n,10,refusal to acknowledge as one's own,
136509,05385339,n,10,an instance of driving away or warding off,
136510,05385451,n,10,"a brief and unsympathetic rejection: ""they made short shrift of my request""",
136511,05385605,n,10,the speech act of objecting,
136512,05385832,n,10,a formal objection to the selection of a particular person as a juror,
136513,05385957,n,10,an expression of grievance or resentment,
136514,05386125,n,10,(formerly) a loud cry (or repeated cries) of pain or rage or sorrow,
136515,05386266,n,10,(law) a formal objection to an opponent's pleadings,1802
136516,05386391,n,10,"(law) the difference of one judge's opinion from that of the majority; ""he expressed his dissent in a contrary opinion""",1802
136517,05386564,n,10,"grounds for adverse criticism: ""his authority is beyond exception""",
136518,05386686,n,10,"informal terms for objecting: ""I have a gripe about the service here""",
136519,05386838,n,10,"a formal and solemn declaration of objection: ""they finished the game under protest to the league prsident""; ""the senator rose to register his protest""; ""the many protestations did not stay the execution""",
136520,05387111,n,10,"the act of making a strong public expression of disagreement and disapproval: ""he shouted his protests at the umpire""; ""a shower of protest was heard from the rear of the hall""",
136521,05387341,n,10,a complaint about a (real or imaginary) wrong that causes resentment and is grounds for action,
136522,05387491,n,10,a gruff or angry utterance (suggestive of the growling of an animal),
136523,05387614,n,10,a complaint uttered in a plaintive whining way,
136524,05387722,n,10,a complaint uttered in a low and indistinct tone,
136525,05387878,n,10,"a cry of sorrow and grief: ""their pitiful laments could be heard throughout the ward""",
136526,05388046,n,10,"a long and mournful complaint: ""a jeremiad against any form of government""",
136527,05388175,n,10,a speech act that conveys information,
136528,05388391,n,10,informing by words,
136529,05388537,n,10,"advance notification of the intention to withdraw from an arrangement or contract: ""we received a notice to vacate the premises""; ""he gave notice two months before he moved""",1802
136530,05388763,n,10,notification that you have been fired from your job,
136531,05388870,n,10,making something evident,
136532,05389120,n,10,"behavior that makes your feelings public: ""a display of emotion""",1355
136533,05389274,n,10,a deliberate display of emotion for effect,1355
136534,05389374,n,10,a display of extreme remorse or repentance or grief,1355
136535,05389491,n,10,the act of divulging something,
136536,05389592,n,10,something that is discovered,
136537,05389676,n,10,an unintentional disclosure,
136538,05389758,n,10,to furnish incriminating evidence to an officer of the law (usually in return for favors),1802
136539,05389913,n,10,unauthorized (esp. deliberate) disclosure of confidential information,
136540,05390033,n,10,"the disclosure of something secret: ""they feared exposure of their campaign plans""",
136541,05390188,n,10,"the exposure of an impostor or a fraud: ""he published an expose of the graft and corruption in city government""",
136542,05390364,n,10,an acknowledgment of the truth of something,
136543,05390481,n,10,an admission of misdeeds or faults,
136544,05390590,n,10,an admission that you have failed to do or be something you know you should do or be,1802
136545,05390774,n,10,"a point conceded or yielded: ""they won all the concessions they asked for""",
136546,05390941,n,10,an agreement to raise wages,
136547,05391030,n,10,"a concession given to mollify or placate: ""the offer was a sop to my feelings""",
136548,05391158,n,10,formally making a person known to another or to the public,
136549,05391298,n,10,"giving detailed instructions, as for a military operation",
136550,05391410,n,10,"the act of informing by verbal report: ""he heard reports that they were causing trouble""; ""by all accounts they were a happy couple""",
136551,05391713,n,10,"a written document describing the findings of some individual or group: ""this accords with the recent study by Hill and Dale""",
136552,05391971,n,10,"information in some unspecified form: ""it was stuff I had heard before""; ""there's good stuff in that book""",
136553,05392129,n,10,a government report; bound in white,
136554,05392235,n,10,a report published by the British government; bound in blue,
136555,05392350,n,10,a report of work accomplished during a specified time period,
136556,05392472,n,10,a report of the results of a medical examination of a patient,2232
136557,05392594,n,10,"a written evaluation of a student's scholarship and deportment; ""his father signed his report card""",1919
136558,05392760,n,10,report of a mission or task,
136559,05392862,n,10,short account of an incident (especially a biographical one),
136560,05392977,n,10,"an account describing incidents or events: ""after dinner he told the children stories of his adventures""",2657
136561,05393346,n,10,an improbable (unusual or incredible or fanciful) story,2657
136562,05393457,n,10,a tale circulated by word of mouth among the common folk,"1960,2657,2772"
136563,05393587,n,10,a sentimental story or personal distress; designed to arouse sympathy,2657
136564,05393724,n,10,a story about fairies; told to amuse children,2657
136565,05393839,n,10,a tale in rhymed verse for children,2657
136566,05393934,n,10,"an act of narration: ""he was the hero according to his own relation""; ""his endless recounting of the incident eventually became unbearable""",2657
136567,05394151,n,10,an outpouring of gossip,
136568,05394227,n,10,"a report (often malicious) about the doings of other people; ""the divorce caused much gossip""",
136569,05394487,n,10,gossip (usually a mixture of truth and untruth) passed around by word of mouth,
136570,05394636,n,10,"gossip spread by spoken communication: ""the news of their affair was spread by word of mouth""",
136571,05394812,n,10,disgraceful gossip about the private lives of other people,
136572,05394950,n,10,"idle gossip or rumor: ""there has been talk about you lately""",
136573,05395080,n,10,a message informing of danger,
136574,05395289,n,10,needless warnings,
136575,05395361,n,10,a warning serves to make you more alert to danger,
136576,05395473,n,10,"a warning against certain acts: ""a caveat against unfair practices""",
136577,05395603,n,10,an early warning about a future event,
136578,05395712,n,10,(military) a warning prior to the start of a threatening act,1781
136579,05395854,n,10,(military) a warning after the initiation of a hostile act,1781
136580,05395993,n,10,"a warning that something unpleasant is immanent: ""they were under threat of arrest""",
136581,05396129,n,10,(military) a warning to national policy makers that an enemy intends to launch an attack in the near future,1781
136582,05396300,n,10,(military) a warning to national policy makers that an enemy intends war or is preparing for war and is on a course that increases the risk of war,1781
136583,05396507,n,10,a verbal commitment by one person to another agreeing to do (or not to do) something in the future,
136584,05396749,n,10,"a promise: ""he gave his word""",
136585,05396854,n,10,"a statement intended to inspire confidence: ""the President's assurances were not respected""",
136586,05397001,n,10,"a binding commitment to do or give or refrain from something: ""an assurance of help when needed""; ""signed a pledge never to reveal the secret""",
136587,05397262,n,10,a solemn pledge of fidelity,
136588,05397350,n,10,a mutual promise to marry,
136589,05397470,n,10,a mutual promise of a couple not to date anyone else; on college campuses it is signaled by the giving of a fraternity pin,
136590,05397646,n,10,the giving of a ring as a token of engagement,
136591,05397745,n,10,a promise that an unaccepted offer will be renewed in the future,
136592,05397866,n,10,an acknowledgment of appreciation,
136593,05398035,n,10,"an expression of gratitude: ""he expressed his appreciation in a short note""",
136594,05398169,n,10,a conversational expression of gratitude,
136595,05398265,n,10,an appearance by actors or performers at the end of the concert or play in order to acknowledge the applause of the audience,
136596,05398454,n,10,speaking of yourself in superlatives,
136597,05398653,n,10,"an instance of boastful talk: ""his brag is worse than his fight""",
136598,05398823,n,10,vain and empty boasting,
136599,05398928,n,10,extravagant self-praise,
136600,05399003,n,10,the act of putting forth your own opinions in a boastful or inconsiderate manner that implies you feel superior to others,
136601,05399185,n,10,"the verbal act of naming: ""the part he failed was the naming of state capitals""",
136602,05399371,n,10,the act of designating,
136603,05399469,n,10,naming numbers,
136604,05399540,n,10,the act of indicating,
136605,05399631,n,10,naming explicitly,
136606,05399705,n,10,a call to engage in a contest or fight,
136607,05399907,n,10,"a challenge to do something dangerous or foolhardy: ""he could never refuse a dare""",
136608,05400049,n,10,a bold challenge,
136609,05400125,n,10,a challenge to a fight or duel,
136610,05400210,n,10,a hostile challenge,
136611,05400284,n,10,a challenge to defend what someone has said,
136612,05400420,n,10,as by a sentry,
136613,05400506,n,10,a public act of denouncing,
136614,05400696,n,10,severe censure,
136615,05400768,n,10,thunderous verbal attack,
136616,05400861,n,10,a violent denunciation,
136617,05400960,n,10,the act of damning,
136618,05401034,n,10,an appeal to some supernatural power to inflict evil on someone or some group,
136619,05401227,n,10,a formal ecclesiastical curse accompanied by excommunication,1565
136620,05401342,n,10,"a curse that invokes evil (and usually serves as an insult); ""he suffered the imprecations of the mob""",
136621,05401516,n,10,a formal charge of wrongdoing brought against a person; an imputation of blame or guilt,1802
136622,05401832,n,10,mutual accusations,1802
136623,05401910,n,10,"a detailed statement giving facts and figures: ""his wife gave a recital of his infidelities""",
136624,05402056,n,10,"a public instance of reciting or repeating something prepared: ""the program included songs and recitations of well-loved poems""",2425
136625,05402260,n,10,a formal document written for a prosecuting attorney charging a person with some offense,1802
136626,05402481,n,10,an indictment charging someone with murder,1802
136627,05402583,n,10,an indictment endorsed by a grand jury,1802
136628,05402677,n,10,a formal document charging a public official with misconduct in office,1802
136629,05402805,n,10,a legal document calling someone to court to answer an indictment,1802
136630,05402928,n,10,a formal accusation against somebody,1802
136631,05403087,n,10,an allegation that something imposes an illegal obligation or denies some legal right or causes injustice,1802
136632,05403248,n,10,bringing a charge or accusation against someone,1802
136633,05403362,n,10,a written statement of the grounds of complaint made to court law asking for the grievance to be redressed,1802
136634,05403521,n,10,"a statement attributing something dishonest (especially a criminal offense); ""he denied the imputation""",1802
136635,05403681,n,10,"an accusation of wrongdoing: ""the book is an indictment of modern philosophy""",1802
136636,05403815,n,10,formal accusation of a crime,1802
136637,05403901,n,10,"the act of making accusations: ""preferment of charges""",1802
136638,05404012,n,10,"an accusation that you are responsible for some lapse or misdeed: ""his incrimination was based on my testimony""; ""the police laid the blame on on the driver""",1802
136639,05404269,n,10,a charge that implicates someone (usually of wrongdoing),1802
136640,05404433,n,10,an accusation that is understood without needing to be spoken,1802
136641,05404580,n,10,an indirect (and usually malicious) implication,1802
136642,05404696,n,10,an accusation that incriminates yourself,1802
136643,05404801,n,10,"a formal spoken communication delivered to an audience: ""he listened to an address on minor Roman poets""",
136644,05405205,n,10,an address to an academic meeting or seminar,1922
136645,05405306,n,10,"an extemporaneous speech or remark: ""a witty impromptu must not sound premeditated""",
136646,05405445,n,10,a short musical passage that seems to have been made spontaneously without advance preparation,2536
136647,05405595,n,10,an address delivered at an inaugural ceremony (especially by a US president),"1675,1718"
136648,05405766,n,10,the principal theme in a speech or literary work,
136649,05405887,n,10,a speech setting forth the keynote,
136650,05406019,n,10,"a speech that is open to the public: ""he attended a lecture on telecommunications""",
136651,05406179,n,10,"any long and tedious address or recital: ""the patient recited a litany of complaints""",
136652,05406317,n,10,"addressing an audience formally (usually a long and rhetorical address and often pompous); ""he loved the sound of his own oratory""",
136653,05406573,n,10,"an instance of oratory: ""he delivered an oration on the decline of family values""",
136654,05406727,n,10,"delivering an address to a public audience: ""the people came to see the candidates and hear the speaking""",
136655,05406961,n,10,the formal presentation of and opposition to a stated proposition (usually followed by a vote),1718
136656,05407138,n,10,vehement oratory,
136657,05407248,n,10,bombastic declamation,
136658,05407359,n,10,a long monotonous harangue,
136659,05407438,n,10,declaiming wildly,
136660,05407515,n,10,political oratory,1718
136661,05407591,n,10,a farewell oration delivered by the most outstanding member of a graduating class,
136662,05407766,n,10,an address of a religious nature (usually delivered during a church service),1565
136663,05407991,n,10,a farewell sermon to a graduating class at their commencement ceremonies,"1675,1922"
136664,05408142,n,10,preaching the gospel of Christ in the manner of the early church,1565
136665,05408270,n,10,the first major discourse delivered by Jesus; Matthew 5-7 and Luke 6:20-49,1565
136666,05408448,n,10,a sermon on a moral or religious topic,1565
136667,05408552,n,10,the act of persuading (or attempting to persuade),
136668,05408794,n,10,"a means of persuading or arguing: ""he used all his conversational weapons""",
136669,05408933,n,10,a successful persuasion,
136670,05409013,n,10,the act of exhorting; an earnest attempt at persuasion,
136671,05409138,n,10,"the act of suggesting: ""it was a suggestion we couldn't refuse""",
136672,05409270,n,10,persuasion not to do something; the act of talking someone out of an intended course of action,
136673,05409439,n,10,an expression of opposition to a course of action,
136674,05409575,n,10,persuasion of voters in a political campaign,
136675,05409708,n,10,persuasion by means of empty slogans,
136676,05409803,n,10,a message issued in behalf of some product or cause or institution,1794
136677,05410086,n,10,subject matter that is calculated to excite and please vulgar tastes,
136678,05410251,n,10,a sensational message (in a film or play or novel),
136679,05410355,n,10,a promotion intended to create goodwill for a person or institution,1794
136680,05410485,n,10,a promotional statement (as found on the dust jackets of books),1794
136681,05410614,n,10,a paper jacket for a book; a jacket on which promotional information is printed,1794
136682,05410821,n,10,blatant or sensational promotion,
136683,05410931,n,10,promotion by means of an argument and demonstration,"1794,2872"
136684,05411061,n,10,a public promotion of some product or service,1794
136685,05411302,n,10,a printed advertisement that is published in a newspaper,1794
136686,05411461,n,10,promotion that supplements or coordinates advertising,1794
136687,05411576,n,10,a newspaper advertisement stating what is wanted,1794
136688,05411678,n,10,a commercially sponsored ad on radio or television,1794
